number,value,datetime_start,datetime_complete,duration,params_default_distribution,params_enforce_min_max_values,user_attrs_corr_similarity,user_attrs_dcr,user_attrs_dcr_norm,user_attrs_error,user_attrs_fidelity,user_attrs_ks_similarity,user_attrs_mean_f1_gap,user_attrs_mean_trtr_f1,user_attrs_mean_tstr_f1,user_attrs_mia_auc,user_attrs_nndr,user_attrs_nndr_norm,user_attrs_objective,user_attrs_privacy_risk,user_attrs_sdv_quality,user_attrs_utility,user_attrs_w_fidelity,user_attrs_w_privacy_risk,user_attrs_w_utility,state
0,0.484556311594707,2026-08-14 14:24:23.996054,2026-08-14 14:24:25.051346,0 days 00:00:01.055292,truncnorm,True,0.9415351703159142,2.5135712113936663,0.0,,0.9047980708013459,0.8680609712867777,0.34003984507918067,0.9396481266399964,0.5996082815608158,0.9826642335766422,0.9486574110584184,0.9486574110584184,0.484556311594707,0.7067348934707955,,0.6599601549208194,0.4,0.2,0.4,COMPLETE
1,0.18636822778569082,2026-08-14 14:24:25.051649,2026-08-14 14:24:25.932977,0 days 00:00:00.881328,uniform,True,0.8814659092537666,10.894882984177684,0.0,,0.7145011219434376,0.5475363346331088,0.8938412203679741,0.9396481266399964,0.04580690627202255,0.9906612279948476,0.9528398325831694,0.9528398325831694,0.18636822778569082,0.7094786642224731,,0.10615877963202591,0.4,0.2,0.4,COMPLETE
2,0.3905041681898793,2026-08-14 14:24:25.933176,2026-08-14 14:24:27.309436,0 days 00:00:01.376260,gamma,False,0.8525762732673771,26.04438026671693,0.0,,0.7970786364564464,0.7415809996455158,0.4683426820320504,0.9396481266399964,0.47130544460794616,0.9999999999999999,0.9834964403353494,0.9834964403353494,0.3905041681898793,0.7049510678993951,,0.5316573179679496,0.4,0.2,0.4,COMPLETE
3,0.18636822778569082,2026-08-14 14:24:27.309687,2026-08-14 14:24:28.202496,0 days 00:00:00.892809,uniform,False,0.8814659092537666,10.894882984177684,0.0,,0.7145011219434376,0.5475363346331088,0.8938412203679741,0.9396481266399964,0.04580690627202255,0.9906612279948476,0.9528398325831694,0.9528398325831694,0.18636822778569082,0.7094786642224731,,0.10615877963202591,0.4,0.2,0.4,COMPLETE
4,,2026-08-14 14:24:28.202846,2026-08-14 14:24:28.222669,0 days 00:00:00.019823,gaussian,False,,,,ValueError: Invalid distribution specification 'gaussian'.,,,,,,,,,,,,,,,,PRUNED
5,0.5069075196006584,2026-08-14 14:24:28.222803,2026-08-14 14:24:30.250365,0 days 00:00:02.027562,beta,False,0.9276012190000389,2.4887677092167233,0.0,,0.918674767599984,0.9097483161999292,0.31783076271736943,0.9396481266399964,0.6218173639226271,0.9007084585659081,0.9440127250700562,0.9440127250700562,0.5069075196006584,0.6671504117619371,,0.6821692372826306,0.4,0.2,0.4,COMPLETE
6,0.484556311594707,2026-08-14 14:24:30.250599,2026-08-14 14:24:31.205990,0 days 00:00:00.955391,truncnorm,False,0.9415351703159142,2.5135712113936663,0.0,,0.9047980708013459,0.8680609712867777,0.34003984507918067,0.9396481266399964,0.5996082815608158,0.9826642335766422,0.9486574110584184,0.9486574110584184,0.484556311594707,0.7067348934707955,,0.6599601549208194,0.4,0.2,0.4,COMPLETE
7,0.484556311594707,2026-08-14 14:24:31.206184,2026-08-14 14:24:32.183518,0 days 00:00:00.977334,truncnorm,False,0.9415351703159142,2.5135712113936663,0.0,,0.9047980708013459,0.8680609712867777,0.34003984507918067,0.9396481266399964,0.5996082815608158,0.9826642335766422,0.9486574110584184,0.9486574110584184,0.484556311594707,0.7067348934707955,,0.6599601549208194,0.4,0.2,0.4,COMPLETE
8,0.18636822778569082,2026-08-14 14:24:32.183700,2026-08-14 14:24:33.054143,0 days 00:00:00.870443,uniform,False,0.8814659092537666,10.894882984177684,0.0,,0.7145011219434376,0.5475363346331088,0.8938412203679741,0.9396481266399964,0.04580690627202255,0.9906612279948476,0.9528398325831694,0.9528398325831694,0.18636822778569082,0.7094786642224731,,0.10615877963202591,0.4,0.2,0.4,COMPLETE
9,0.18636822778569082,2026-08-14 14:24:33.054322,2026-08-14 14:24:33.924704,0 days 00:00:00.870382,uniform,False,0.8814659092537666,10.894882984177684,0.0,,0.7145011219434376,0.5475363346331088,0.8938412203679741,0.9396481266399964,0.04580690627202255,0.9906612279948476,0.9528398325831694,0.9528398325831694,0.18636822778569082,0.7094786642224731,,0.10615877963202591,0.4,0.2,0.4,COMPLETE
10,0.5049608644676029,2026-08-14 14:24:33.924888,2026-08-14 14:24:35.980630,0 days 00:00:02.055742,beta,True,0.9279149620677082,2.4887677092167233,0.0,,0.9188316391338187,0.9097483161999292,0.32255410954597946,0.9396481266399964,0.6170940170940171,0.9018892228424217,0.9439795819451537,0.9439795819451537,0.5049608644676029,0.6677507368376647,,0.6774458904540206,0.4,0.2,0.4,COMPLETE
11,0.5049608644676029,2026-08-14 14:24:35.980993,2026-08-14 14:24:38.067888,0 days 00:00:02.086895,beta,True,0.9279149620677082,2.4887677092167233,0.0,,0.9188316391338187,0.9097483161999292,0.32255410954597946,0.9396481266399964,0.6170940170940171,0.9018892228424217,0.9439795819451537,0.9439795819451537,0.5049608644676029,0.6677507368376647,,0.6774458904540206,0.4,0.2,0.4,COMPLETE
12,0.5049608644676029,2026-08-14 14:24:38.068218,2026-08-14 14:24:40.133324,0 days 00:00:02.065106,beta,True,0.9279149620677082,2.4887677092167233,0.0,,0.9188316391338187,0.9097483161999292,0.32255410954597946,0.9396481266399964,0.6170940170940171,0.9018892228424217,0.9439795819451537,0.9439795819451537,0.5049608644676029,0.6677507368376647,,0.6774458904540206,0.4,0.2,0.4,COMPLETE
13,0.5049608644676029,2026-08-14 14:24:40.133604,2026-08-14 14:24:42.209154,0 days 00:00:02.075550,beta,True,0.9279149620677082,2.4887677092167233,0.0,,0.9188316391338187,0.9097483161999292,0.32255410954597946,0.9396481266399964,0.6170940170940171,0.9018892228424217,0.9439795819451537,0.9439795819451537,0.5049608644676029,0.6677507368376647,,0.6774458904540206,0.4,0.2,0.4,COMPLETE
14,0.5049608644676029,2026-08-14 14:24:42.209351,2026-08-14 14:24:44.315063,0 days 00:00:02.105712,beta,True,0.9279149620677082,2.4887677092167233,0.0,,0.9188316391338187,0.9097483161999292,0.32255410954597946,0.9396481266399964,0.6170940170940171,0.9018892228424217,0.9439795819451537,0.9439795819451537,0.5049608644676029,0.6677507368376647,,0.6774458904540206,0.4,0.2,0.4,COMPLETE
15,0.5049608644676029,2026-08-14 14:24:44.315367,2026-08-14 14:24:46.383712,0 days 00:00:02.068345,beta,True,0.9279149620677082,2.4887677092167233,0.0,,0.9188316391338187,0.9097483161999292,0.32255410954597946,0.9396481266399964,0.6170940170940171,0.9018892228424217,0.9439795819451537,0.9439795819451537,0.5049608644676029,0.6677507368376647,,0.6774458904540206,0.4,0.2,0.4,COMPLETE
16,,2026-08-14 14:24:46.383906,2026-08-14 14:24:46.403797,0 days 00:00:00.019891,gaussian,True,,,,ValueError: Invalid distribution specification 'gaussian'.,,,,,,,,,,,,,,,,PRUNED
17,0.3905041681898793,2026-08-14 14:24:46.403908,2026-08-14 14:24:47.789571,0 days 00:00:01.385663,gamma,False,0.8525762732673771,26.04438026671693,0.0,,0.7970786364564464,0.7415809996455158,0.4683426820320504,0.9396481266399964,0.47130544460794616,0.9999999999999999,0.9834964403353494,0.9834964403353494,0.3905041681898793,0.7049510678993951,,0.5316573179679496,0.4,0.2,0.4,COMPLETE
18,0.5049608644676029,2026-08-14 14:24:47.789856,2026-08-14 14:24:49.847177,0 days 00:00:02.057321,beta,True,0.9279149620677082,2.4887677092167233,0.0,,0.9188316391338187,0.9097483161999292,0.32255410954597946,0.9396481266399964,0.6170940170940171,0.9018892228424217,0.9439795819451537,0.9439795819451537,0.5049608644676029,0.6677507368376647,,0.6774458904540206,0.4,0.2,0.4,COMPLETE
19,0.5069075196006584,2026-08-14 14:24:49.847362,2026-08-14 14:24:51.917501,0 days 00:00:02.070139,beta,False,0.9276012190000389,2.4887677092167233,0.0,,0.918674767599984,0.9097483161999292,0.31783076271736943,0.9396481266399964,0.6218173639226271,0.9007084585659081,0.9440127250700562,0.9440127250700562,0.5069075196006584,0.6671504117619371,,0.6821692372826306,0.4,0.2,0.4,COMPLETE
