number,value,datetime_start,datetime_complete,duration,params_default_distribution,params_enforce_min_max_values,user_attrs_corr_similarity,user_attrs_dcr,user_attrs_dcr_norm,user_attrs_fidelity,user_attrs_ks_similarity,user_attrs_mean_f1_gap,user_attrs_mean_trtr_f1,user_attrs_mean_tstr_f1,user_attrs_mia_auc,user_attrs_nndr,user_attrs_nndr_norm,user_attrs_objective,user_attrs_privacy_risk,user_attrs_sdv_quality,user_attrs_utility,user_attrs_w_fidelity,user_attrs_w_privacy_risk,user_attrs_w_utility,state
0,0.4962751394236943,2026-09-02 13:10:21.408829,2026-09-02 13:10:22.460861,0 days 00:00:01.052032,truncnorm,True,0.94812404924748,2.5143770814241755,0.0,0.8238834531951685,0.6996428571428571,0.228061466037322,0.8252703000882612,0.5972088340509393,0.9947569444444444,0.9570339834166677,0.9570339834166677,0.4962751394236943,0.710268277197222,,0.771938533962678,0.4,0.2,0.4,COMPLETE
1,0.20559042737672586,2026-09-02 13:10:22.461356,2026-09-02 13:10:23.430420,0 days 00:00:00.969064,uniform,True,0.9432491547523377,9.224628154904849,0.0,0.6716245773761689,0.39999999999999997,0.7998017154939528,0.8252703000882612,0.02546858459430849,0.9997222222222223,0.9472250807676948,0.9472250807676948,0.20559042737672586,0.7156935868808028,,0.20019828450604715,0.4,0.2,0.4,COMPLETE
2,0.4495238155215864,2026-09-02 13:10:23.430680,2026-09-02 13:10:24.729354,0 days 00:00:01.298674,gamma,False,0.9521362149775323,2.144904686641385,0.0,0.7481216789173375,0.5441071428571428,0.2667112750075646,0.8252703000882612,0.5585590250806967,1.0,0.9493275659612865,0.9493275659612865,0.4495238155215864,0.715201730211614,,0.7332887249924354,0.4,0.2,0.4,COMPLETE
3,0.20559042737672586,2026-09-02 13:10:24.729633,2026-09-02 13:10:25.593999,0 days 00:00:00.864366,uniform,False,0.9432491547523377,9.224628154904849,0.0,0.6716245773761689,0.39999999999999997,0.7998017154939528,0.8252703000882612,0.02546858459430849,0.9997222222222223,0.9472250807676948,0.9472250807676948,0.20559042737672586,0.7156935868808028,,0.20019828450604715,0.4,0.2,0.4,COMPLETE
4,0.549971572183937,2026-09-02 13:10:25.594328,2026-09-02 13:10:26.382926,0 days 00:00:00.788598,norm,False,0.9698425532017415,2.6929306858273714,0.0,0.8729569908865851,0.7760714285714286,0.14245728796108983,0.8252703000882612,0.6828130121271715,0.9996875,0.9623406835623142,0.9623406835623142,0.549971572183937,0.7111415449313057,,0.8575427120389102,0.4,0.2,0.4,COMPLETE
5,0.54071441884271,2026-09-02 13:10:26.383139,2026-09-02 13:10:28.069785,0 days 00:00:01.686646,beta,False,0.9560486915098351,2.4793034236825644,0.0,0.8450779171834889,0.7341071428571427,0.1382693125458151,0.8252703000882612,0.6870009875424462,0.9954513888888888,0.9589352646088218,0.9589352646088218,0.54071441884271,0.7100451150617979,,0.8617306874541849,0.4,0.2,0.4,COMPLETE
6,0.4962751394236943,2026-09-02 13:10:28.070052,2026-09-02 13:10:29.165707,0 days 00:00:01.095655,truncnorm,False,0.94812404924748,2.5143770814241755,0.0,0.8238834531951685,0.6996428571428571,0.228061466037322,0.8252703000882612,0.5972088340509393,0.9947569444444444,0.9570339834166677,0.9570339834166677,0.4962751394236943,0.710268277197222,,0.771938533962678,0.4,0.2,0.4,COMPLETE
7,0.4962751394236943,2026-09-02 13:10:29.165940,2026-09-02 13:10:30.170356,0 days 00:00:01.004416,truncnorm,False,0.94812404924748,2.5143770814241755,0.0,0.8238834531951685,0.6996428571428571,0.228061466037322,0.8252703000882612,0.5972088340509393,0.9947569444444444,0.9570339834166677,0.9570339834166677,0.4962751394236943,0.710268277197222,,0.771938533962678,0.4,0.2,0.4,COMPLETE
8,0.20559042737672586,2026-09-02 13:10:30.170679,2026-09-02 13:10:31.151260,0 days 00:00:00.980581,uniform,False,0.9432491547523377,9.224628154904849,0.0,0.6716245773761689,0.39999999999999997,0.7998017154939528,0.8252703000882612,0.02546858459430849,0.9997222222222223,0.9472250807676948,0.9472250807676948,0.20559042737672586,0.7156935868808028,,0.20019828450604715,0.4,0.2,0.4,COMPLETE
9,0.20559042737672586,2026-09-02 13:10:31.151672,2026-09-02 13:10:31.978960,0 days 00:00:00.827288,uniform,False,0.9432491547523377,9.224628154904849,0.0,0.6716245773761689,0.39999999999999997,0.7998017154939528,0.8252703000882612,0.02546858459430849,0.9997222222222223,0.9472250807676948,0.9472250807676948,0.20559042737672586,0.7156935868808028,,0.20019828450604715,0.4,0.2,0.4,COMPLETE
10,0.5592679208236706,2026-09-02 13:10:31.979180,2026-09-02 13:10:32.772903,0 days 00:00:00.793723,norm,True,0.975059558453595,2.4592602571372106,0.0,0.8780654935125118,0.7810714285714286,0.13125030386113432,0.8252703000882612,0.694019996227127,0.9697916666666666,0.958683527163102,0.958683527163102,0.5592679208236706,0.6972907751844026,,0.8687496961388657,0.4,0.2,0.4,COMPLETE
11,0.5592679208236706,2026-09-02 13:10:32.773133,2026-09-02 13:10:33.819557,0 days 00:00:01.046424,norm,True,0.975059558453595,2.4592602571372106,0.0,0.8780654935125118,0.7810714285714286,0.13125030386113432,0.8252703000882612,0.694019996227127,0.9697916666666666,0.958683527163102,0.958683527163102,0.5592679208236706,0.6972907751844026,,0.8687496961388657,0.4,0.2,0.4,COMPLETE
12,0.5592679208236706,2026-09-02 13:10:33.819828,2026-09-02 13:10:34.896233,0 days 00:00:01.076405,norm,True,0.975059558453595,2.4592602571372106,0.0,0.8780654935125118,0.7810714285714286,0.13125030386113432,0.8252703000882612,0.694019996227127,0.9697916666666666,0.958683527163102,0.958683527163102,0.5592679208236706,0.6972907751844026,,0.8687496961388657,0.4,0.2,0.4,COMPLETE
13,0.5592679208236706,2026-09-02 13:10:34.896657,2026-09-02 13:10:35.878045,0 days 00:00:00.981388,norm,True,0.975059558453595,2.4592602571372106,0.0,0.8780654935125118,0.7810714285714286,0.13125030386113432,0.8252703000882612,0.694019996227127,0.9697916666666666,0.958683527163102,0.958683527163102,0.5592679208236706,0.6972907751844026,,0.8687496961388657,0.4,0.2,0.4,COMPLETE
14,0.5592679208236706,2026-09-02 13:10:35.878263,2026-09-02 13:10:36.899262,0 days 00:00:01.020999,norm,True,0.975059558453595,2.4592602571372106,0.0,0.8780654935125118,0.7810714285714286,0.13125030386113432,0.8252703000882612,0.694019996227127,0.9697916666666666,0.958683527163102,0.958683527163102,0.5592679208236706,0.6972907751844026,,0.8687496961388657,0.4,0.2,0.4,COMPLETE
15,0.5592679208236706,2026-09-02 13:10:36.899534,2026-09-02 13:10:37.830200,0 days 00:00:00.930666,norm,True,0.975059558453595,2.4592602571372106,0.0,0.8780654935125118,0.7810714285714286,0.13125030386113432,0.8252703000882612,0.694019996227127,0.9697916666666666,0.958683527163102,0.958683527163102,0.5592679208236706,0.6972907751844026,,0.8687496961388657,0.4,0.2,0.4,COMPLETE
16,0.5407144472262284,2026-09-02 13:10:37.830560,2026-09-02 13:10:39.448883,0 days 00:00:01.618323,beta,True,0.9560488334274273,2.4793034236825644,0.0,0.845077988142285,0.7341071428571427,0.1382693125458151,0.8252703000882612,0.6870009875424462,0.9954513888888888,0.9589352646088218,0.9589352646088218,0.5407144472262284,0.7100451150617979,,0.8617306874541849,0.4,0.2,0.4,COMPLETE
17,0.45397960185148734,2026-09-02 13:10:39.449167,2026-09-02 13:10:40.824680,0 days 00:00:01.375513,gamma,True,0.9517293640354743,2.1360609049614694,0.0,0.7479182534463085,0.5441071428571428,0.2553616380386778,0.8252703000882612,0.5699086620495835,1.0,0.9492825948072529,0.9492825948072529,0.45397960185148734,0.7152152215578242,,0.7446383619613222,0.4,0.2,0.4,COMPLETE
18,0.5592679208236706,2026-09-02 13:10:40.825083,2026-09-02 13:10:41.793087,0 days 00:00:00.968004,norm,True,0.975059558453595,2.4592602571372106,0.0,0.8780654935125118,0.7810714285714286,0.13125030386113432,0.8252703000882612,0.694019996227127,0.9697916666666666,0.958683527163102,0.958683527163102,0.5592679208236706,0.6972907751844026,,0.8687496961388657,0.4,0.2,0.4,COMPLETE
19,0.5592679208236706,2026-09-02 13:10:41.793324,2026-09-02 13:10:42.829099,0 days 00:00:01.035775,norm,True,0.975059558453595,2.4592602571372106,0.0,0.8780654935125118,0.7810714285714286,0.13125030386113432,0.8252703000882612,0.694019996227127,0.9697916666666666,0.958683527163102,0.958683527163102,0.5592679208236706,0.6972907751844026,,0.8687496961388657,0.4,0.2,0.4,COMPLETE
