number,value,datetime_start,datetime_complete,duration,params_default_distribution,params_enforce_min_max_values,user_attrs_corr_similarity,user_attrs_dcr,user_attrs_dcr_norm,user_attrs_fidelity,user_attrs_ks_similarity,user_attrs_mean_f1_gap,user_attrs_mean_trtr_f1,user_attrs_mean_tstr_f1,user_attrs_mia_auc,user_attrs_nndr,user_attrs_nndr_norm,user_attrs_objective,user_attrs_privacy_risk,user_attrs_sdv_quality,user_attrs_utility,user_attrs_w_fidelity,user_attrs_w_privacy_risk,user_attrs_w_utility,state
0,0.6040947038660973,2026-09-09 09:19:26.908378,2026-09-09 09:19:27.423652,0 days 00:00:00.515274,truncnorm,True,0.9215851734703626,1.3385058365370792,0.0,0.8633620311796257,0.8051388888888888,-0.5157330201246362,-2.3936871896470606,-1.8779541695224244,0.9969965277777779,0.9741590695337465,0.9741590695337465,0.6040947038660973,0.7062505430287651,,1.0,0.4,0.2,0.4,COMPLETE
1,0.5889671439990264,2026-09-09 09:19:27.423973,2026-09-09 09:19:27.899370,0 days 00:00:00.475397,uniform,True,0.9111809594464069,2.412059810396722,0.0,0.8239932575009812,0.7368055555555554,-1.1415848380130762,-2.3936871896470606,-1.2521023516339844,0.9991145833333335,0.9880216555327876,0.9880216555327876,0.5889671439990264,0.7031507950068305,,1.0,0.4,0.2,0.4,COMPLETE
2,0.25911235775732144,2026-09-09 09:19:27.899723,2026-09-09 09:19:28.589006,0 days 00:00:00.689283,gamma,False,0.9125193375858811,1.3096991747227626,0.0,0.8473707799040516,0.7822222222222222,0.844533616530418,-2.3936871896470606,-3.2382208061774787,0.9998958333333333,0.9661179290200208,0.9661179290200208,0.25911235775732144,0.7101125379606603,,0.15546638346958197,0.4,0.2,0.4,COMPLETE
3,0.5889671439990264,2026-09-09 09:19:28.589241,2026-09-09 09:19:29.047778,0 days 00:00:00.458537,uniform,False,0.9111809594464069,2.412059810396722,0.0,0.8239932575009812,0.7368055555555554,-1.1415848380130762,-2.3936871896470606,-1.2521023516339844,0.9991145833333335,0.9880216555327876,0.9880216555327876,0.5889671439990264,0.7031507950068305,,1.0,0.4,0.2,0.4,COMPLETE
4,0.6186703974863625,2026-09-09 09:19:29.048107,2026-09-09 09:19:29.509227,0 days 00:00:00.461120,norm,False,0.949933039805694,1.339814331164154,0.0,0.8996887421250692,0.8494444444444444,-0.14794140772260356,-2.3936871896470606,-2.245745781924457,0.9960069444444445,0.9732599180129871,0.9732599180129871,0.6186703974863625,0.7060254968183262,,1.0,0.4,0.2,0.4,COMPLETE
5,0.6076574615381343,2026-09-09 09:19:29.509400,2026-09-09 09:19:30.337141,0 days 00:00:00.827741,beta,False,0.9278923241118686,1.406370676471449,0.0,0.8713072731670454,0.8147222222222221,-0.47415847184741367,-2.3936871896470606,-1.919528717799647,0.9931249999999999,0.9741175378552683,0.9741175378552683,0.6076574615381343,0.7043272386434194,,1.0,0.4,0.2,0.4,COMPLETE
6,0.6040947038660973,2026-09-09 09:19:30.337536,2026-09-09 09:19:30.833815,0 days 00:00:00.496279,truncnorm,False,0.9215851734703626,1.3385058365370792,0.0,0.8633620311796257,0.8051388888888888,-0.5157330201246362,-2.3936871896470606,-1.8779541695224244,0.9969965277777779,0.9741590695337465,0.9741590695337465,0.6040947038660973,0.7062505430287651,,1.0,0.4,0.2,0.4,COMPLETE
7,0.6040947038660973,2026-09-09 09:19:30.833999,2026-09-09 09:19:31.327574,0 days 00:00:00.493575,truncnorm,False,0.9215851734703626,1.3385058365370792,0.0,0.8633620311796257,0.8051388888888888,-0.5157330201246362,-2.3936871896470606,-1.8779541695224244,0.9969965277777779,0.9741590695337465,0.9741590695337465,0.6040947038660973,0.7062505430287651,,1.0,0.4,0.2,0.4,COMPLETE
8,0.5889671439990264,2026-09-09 09:19:31.327824,2026-09-09 09:19:31.783988,0 days 00:00:00.456164,uniform,False,0.9111809594464069,2.412059810396722,0.0,0.8239932575009812,0.7368055555555554,-1.1415848380130762,-2.3936871896470606,-1.2521023516339844,0.9991145833333335,0.9880216555327876,0.9880216555327876,0.5889671439990264,0.7031507950068305,,1.0,0.4,0.2,0.4,COMPLETE
9,0.5889671439990264,2026-09-09 09:19:31.784157,2026-09-09 09:19:32.241607,0 days 00:00:00.457450,uniform,False,0.9111809594464069,2.412059810396722,0.0,0.8239932575009812,0.7368055555555554,-1.1415848380130762,-2.3936871896470606,-1.2521023516339844,0.9991145833333335,0.9880216555327876,0.9880216555327876,0.5889671439990264,0.7031507950068305,,1.0,0.4,0.2,0.4,COMPLETE
10,0.6199365640729244,2026-09-09 09:19:32.241770,2026-09-09 09:19:32.713051,0 days 00:00:00.471281,norm,True,0.9470872850947752,1.232097085931845,0.0,0.8982658647696098,0.8494444444444444,-0.32487142698992466,-2.3936871896470606,-2.068815762657136,0.9734722222222221,0.9662906731217102,0.9662906731217102,0.6199365640729244,0.696848909174598,,1.0,0.4,0.2,0.4,COMPLETE
11,0.6199365640729244,2026-09-09 09:19:32.713348,2026-09-09 09:19:33.179806,0 days 00:00:00.466458,norm,True,0.9470872850947752,1.232097085931845,0.0,0.8982658647696098,0.8494444444444444,-0.32487142698992466,-2.3936871896470606,-2.068815762657136,0.9734722222222221,0.9662906731217102,0.9662906731217102,0.6199365640729244,0.696848909174598,,1.0,0.4,0.2,0.4,COMPLETE
12,0.6199365640729244,2026-09-09 09:19:33.179976,2026-09-09 09:19:33.648855,0 days 00:00:00.468879,norm,True,0.9470872850947752,1.232097085931845,0.0,0.8982658647696098,0.8494444444444444,-0.32487142698992466,-2.3936871896470606,-2.068815762657136,0.9734722222222221,0.9662906731217102,0.9662906731217102,0.6199365640729244,0.696848909174598,,1.0,0.4,0.2,0.4,COMPLETE
13,0.6199365640729244,2026-09-09 09:19:33.649087,2026-09-09 09:19:34.178113,0 days 00:00:00.529026,norm,True,0.9470872850947752,1.232097085931845,0.0,0.8982658647696098,0.8494444444444444,-0.32487142698992466,-2.3936871896470606,-2.068815762657136,0.9734722222222221,0.9662906731217102,0.9662906731217102,0.6199365640729244,0.696848909174598,,1.0,0.4,0.2,0.4,COMPLETE
14,0.6199365640729244,2026-09-09 09:19:34.178389,2026-09-09 09:19:34.952558,0 days 00:00:00.774169,norm,True,0.9470872850947752,1.232097085931845,0.0,0.8982658647696098,0.8494444444444444,-0.32487142698992466,-2.3936871896470606,-2.068815762657136,0.9734722222222221,0.9662906731217102,0.9662906731217102,0.6199365640729244,0.696848909174598,,1.0,0.4,0.2,0.4,COMPLETE
15,0.6199365640729244,2026-09-09 09:19:34.952991,2026-09-09 09:19:35.441578,0 days 00:00:00.488587,norm,True,0.9470872850947752,1.232097085931845,0.0,0.8982658647696098,0.8494444444444444,-0.32487142698992466,-2.3936871896470606,-2.068815762657136,0.9734722222222221,0.9662906731217102,0.9662906731217102,0.6199365640729244,0.696848909174598,,1.0,0.4,0.2,0.4,COMPLETE
16,0.607727969756743,2026-09-09 09:19:35.441751,2026-09-09 09:19:36.223595,0 days 00:00:00.781844,beta,True,0.9279913754834446,1.403651995426233,0.0,0.8713567988528333,0.8147222222222221,-0.46963173642981726,-2.3936871896470606,-1.9240554532172434,0.9927430555555556,0.9743259295194204,0.9743259295194204,0.607727969756743,0.7040737489219517,,1.0,0.4,0.2,0.4,COMPLETE
17,0.36848845203343006,2026-09-09 09:19:36.223777,2026-09-09 09:19:36.910270,0 days 00:00:00.686493,gamma,True,0.913031840320338,1.3026555682873093,0.0,0.8476270312712801,0.7822222222222222,0.571401177699618,-2.3936871896470606,-2.9650883673466786,0.9999479166666666,0.9665483711905315,0.9665483711905315,0.36848845203343006,0.710009446976174,,0.42859882230038204,0.4,0.2,0.4,COMPLETE
18,0.6199365640729244,2026-09-09 09:19:36.910439,2026-09-09 09:19:37.371863,0 days 00:00:00.461424,norm,True,0.9470872850947752,1.232097085931845,0.0,0.8982658647696098,0.8494444444444444,-0.32487142698992466,-2.3936871896470606,-2.068815762657136,0.9734722222222221,0.9662906731217102,0.9662906731217102,0.6199365640729244,0.696848909174598,,1.0,0.4,0.2,0.4,COMPLETE
19,0.6199365640729244,2026-09-09 09:19:37.372041,2026-09-09 09:19:37.835119,0 days 00:00:00.463078,norm,True,0.9470872850947752,1.232097085931845,0.0,0.8982658647696098,0.8494444444444444,-0.32487142698992466,-2.3936871896470606,-2.068815762657136,0.9734722222222221,0.9662906731217102,0.9662906731217102,0.6199365640729244,0.696848909174598,,1.0,0.4,0.2,0.4,COMPLETE
