number,value,datetime_start,datetime_complete,duration,params_default_distribution,params_enforce_min_max_values,user_attrs_corr_similarity,user_attrs_dcr,user_attrs_dcr_norm,user_attrs_fidelity,user_attrs_ks_similarity,user_attrs_mean_f1_gap,user_attrs_mean_trtr_f1,user_attrs_mean_tstr_f1,user_attrs_mia_auc,user_attrs_nndr,user_attrs_nndr_norm,user_attrs_objective,user_attrs_privacy_risk,user_attrs_sdv_quality,user_attrs_utility,user_attrs_w_fidelity,user_attrs_w_privacy_risk,user_attrs_w_utility,state
0,0.24219019072843342,2026-09-07 13:08:20.827542,2026-09-07 13:08:21.287038,0 days 00:00:00.459496,truncnorm,True,0.9193566154455564,1.5951837828416182,0.0,0.8438970577227782,0.7684375,0.8872158845744949,-4.1422054251249785,-5.029421309699473,0.9991145833333334,0.9904863300408893,0.9904863300408893,0.24219019072843342,0.7024113926544,,0.11278411542550515,0.4,0.2,0.4,COMPLETE
1,0.17133044877609843,2026-09-07 13:08:21.287544,2026-09-07 13:08:21.686211,0 days 00:00:00.398667,uniform,True,0.9203824219228431,8.497915030211374,0.0,0.8048005859614216,0.68921875,1.8939612479599015,-4.1422054251249785,-6.03616667308488,0.9998871527777778,0.8233154944884601,0.8233154944884601,0.17133044877609843,0.7529489280423509,,0.0,0.4,0.2,0.4,COMPLETE
2,0.41443822935879804,2026-09-07 13:08:21.686487,2026-09-07 13:08:22.272289,0 days 00:00:00.585802,gamma,False,0.9094422085245114,0.7530941758080051,0.0,0.9097992292622556,0.91015625,0.523596384288811,-4.1422054251249785,-4.665801809413789,0.9826909722222223,0.9704364765273735,0.9704364765273735,0.41443822935879804,0.7002145431528992,,0.47640361571118905,0.4,0.2,0.4,COMPLETE
3,0.17133044877609843,2026-09-07 13:08:22.272606,2026-09-07 13:08:22.642171,0 days 00:00:00.369565,uniform,False,0.9203824219228431,8.497915030211374,0.0,0.8048005859614216,0.68921875,1.8939612479599015,-4.1422054251249785,-6.03616667308488,0.9998871527777778,0.8233154944884601,0.8233154944884601,0.17133044877609843,0.7529489280423509,,0.0,0.4,0.2,0.4,COMPLETE
4,0.3655584235467253,2026-09-07 13:08:22.642397,2026-09-07 13:08:23.017010,0 days 00:00:00.374613,norm,False,0.9148217001956421,1.651109822431033,0.0,0.875535850097821,0.8362499999999999,0.6107740172798293,-4.1422054251249785,-4.752979442404808,0.9988541666666667,0.9923184514365876,0.9923184514365876,0.3655584235467253,0.7017315479023571,,0.3892259827201707,0.4,0.2,0.4,COMPLETE
5,0.19928590628911677,2026-09-07 13:08:23.017171,2026-09-07 13:08:23.680350,0 days 00:00:00.663179,beta,False,0.8979385347486064,1.6655558602238338,0.0,0.8583442673743031,0.81875,2.1080127990417648,-4.1422054251249785,-6.250218224166743,0.9995486111111112,0.9317176741751105,0.9317176741751105,0.19928590628911677,0.7202590033030225,,0.0,0.4,0.2,0.4,COMPLETE
6,0.24219019072843342,2026-09-07 13:08:23.680628,2026-09-07 13:08:24.088069,0 days 00:00:00.407441,truncnorm,False,0.9193566154455564,1.5951837828416182,0.0,0.8438970577227782,0.7684375,0.8872158845744949,-4.1422054251249785,-5.029421309699473,0.9991145833333334,0.9904863300408893,0.9904863300408893,0.24219019072843342,0.7024113926544,,0.11278411542550515,0.4,0.2,0.4,COMPLETE
7,0.24219019072843342,2026-09-07 13:08:24.088297,2026-09-07 13:08:24.493441,0 days 00:00:00.405144,truncnorm,False,0.9193566154455564,1.5951837828416182,0.0,0.8438970577227782,0.7684375,0.8872158845744949,-4.1422054251249785,-5.029421309699473,0.9991145833333334,0.9904863300408893,0.9904863300408893,0.24219019072843342,0.7024113926544,,0.11278411542550515,0.4,0.2,0.4,COMPLETE
8,0.17133044877609843,2026-09-07 13:08:24.493594,2026-09-07 13:08:24.862137,0 days 00:00:00.368543,uniform,False,0.9203824219228431,8.497915030211374,0.0,0.8048005859614216,0.68921875,1.8939612479599015,-4.1422054251249785,-6.03616667308488,0.9998871527777778,0.8233154944884601,0.8233154944884601,0.17133044877609843,0.7529489280423509,,0.0,0.4,0.2,0.4,COMPLETE
9,0.17133044877609843,2026-09-07 13:08:24.862428,2026-09-07 13:08:25.229554,0 days 00:00:00.367126,uniform,False,0.9203824219228431,8.497915030211374,0.0,0.8048005859614216,0.68921875,1.8939612479599015,-4.1422054251249785,-6.03616667308488,0.9998871527777778,0.8233154944884601,0.8233154944884601,0.17133044877609843,0.7529489280423509,,0.0,0.4,0.2,0.4,COMPLETE
10,0.32703219417895557,2026-09-07 13:08:25.229700,2026-09-07 13:08:25.816265,0 days 00:00:00.586565,gamma,True,0.9099881051251312,0.7226494455569787,0.0,0.9100721775625655,0.91015625,0.7430241834310083,-4.1422054251249785,-4.885229608555987,0.9797829861111111,0.9698549189573966,0.9698549189573966,0.32703219417895557,0.6989350173683366,,0.2569758165689917,0.4,0.2,0.4,COMPLETE
11,0.3655584235467253,2026-09-07 13:08:25.816497,2026-09-07 13:08:26.192878,0 days 00:00:00.376381,norm,False,0.9148217001956421,1.651109822431033,0.0,0.875535850097821,0.8362499999999999,0.6107740172798293,-4.1422054251249785,-4.752979442404808,0.9988541666666667,0.9923184514365876,0.9923184514365876,0.3655584235467253,0.7017315479023571,,0.3892259827201707,0.4,0.2,0.4,COMPLETE
12,0.3655584235467253,2026-09-07 13:08:26.193038,2026-09-07 13:08:26.567391,0 days 00:00:00.374353,norm,False,0.9148217001956421,1.651109822431033,0.0,0.875535850097821,0.8362499999999999,0.6107740172798293,-4.1422054251249785,-4.752979442404808,0.9988541666666667,0.9923184514365876,0.9923184514365876,0.3655584235467253,0.7017315479023571,,0.3892259827201707,0.4,0.2,0.4,COMPLETE
13,0.41443822935879804,2026-09-07 13:08:26.567537,2026-09-07 13:08:27.150346,0 days 00:00:00.582809,gamma,False,0.9094422085245114,0.7530941758080051,0.0,0.9097992292622556,0.91015625,0.523596384288811,-4.1422054251249785,-4.665801809413789,0.9826909722222223,0.9704364765273735,0.9704364765273735,0.41443822935879804,0.7002145431528992,,0.47640361571118905,0.4,0.2,0.4,COMPLETE
14,0.32703219417895557,2026-09-07 13:08:27.150610,2026-09-07 13:08:27.743342,0 days 00:00:00.592732,gamma,True,0.9099881051251312,0.7226494455569787,0.0,0.9100721775625655,0.91015625,0.7430241834310083,-4.1422054251249785,-4.885229608555987,0.9797829861111111,0.9698549189573966,0.9698549189573966,0.32703219417895557,0.6989350173683366,,0.2569758165689917,0.4,0.2,0.4,COMPLETE
15,0.41443822935879804,2026-09-07 13:08:27.743513,2026-09-07 13:08:28.325315,0 days 00:00:00.581802,gamma,False,0.9094422085245114,0.7530941758080051,0.0,0.9097992292622556,0.91015625,0.523596384288811,-4.1422054251249785,-4.665801809413789,0.9826909722222223,0.9704364765273735,0.9704364765273735,0.41443822935879804,0.7002145431528992,,0.47640361571118905,0.4,0.2,0.4,COMPLETE
16,0.41443822935879804,2026-09-07 13:08:28.325526,2026-09-07 13:08:28.901999,0 days 00:00:00.576473,gamma,False,0.9094422085245114,0.7530941758080051,0.0,0.9097992292622556,0.91015625,0.523596384288811,-4.1422054251249785,-4.665801809413789,0.9826909722222223,0.9704364765273735,0.9704364765273735,0.41443822935879804,0.7002145431528992,,0.47640361571118905,0.4,0.2,0.4,COMPLETE
17,0.41443822935879804,2026-09-07 13:08:28.902149,2026-09-07 13:08:29.479257,0 days 00:00:00.577108,gamma,False,0.9094422085245114,0.7530941758080051,0.0,0.9097992292622556,0.91015625,0.523596384288811,-4.1422054251249785,-4.665801809413789,0.9826909722222223,0.9704364765273735,0.9704364765273735,0.41443822935879804,0.7002145431528992,,0.47640361571118905,0.4,0.2,0.4,COMPLETE
18,0.1992769734465863,2026-09-07 13:08:29.479411,2026-09-07 13:08:30.131921,0 days 00:00:00.652510,beta,True,0.897964305922687,1.6655558602238338,0.0,0.8583571529613434,0.81875,2.1080127990417648,-4.1422054251249785,-6.250218224166743,0.9995138888888888,0.9314250191822964,0.9314250191822964,0.1992769734465863,0.7203294386897554,,0.0,0.4,0.2,0.4,COMPLETE
19,0.41443822935879804,2026-09-07 13:08:30.132074,2026-09-07 13:08:30.715124,0 days 00:00:00.583050,gamma,False,0.9094422085245114,0.7530941758080051,0.0,0.9097992292622556,0.91015625,0.523596384288811,-4.1422054251249785,-4.665801809413789,0.9826909722222223,0.9704364765273735,0.9704364765273735,0.41443822935879804,0.7002145431528992,,0.47640361571118905,0.4,0.2,0.4,COMPLETE
