number,value,datetime_start,datetime_complete,duration,params_default_distribution,params_enforce_min_max_values,user_attrs_corr_similarity,user_attrs_dcr,user_attrs_dcr_norm,user_attrs_fidelity,user_attrs_ks_similarity,user_attrs_mean_f1_gap,user_attrs_mean_trtr_f1,user_attrs_mean_tstr_f1,user_attrs_mia_auc,user_attrs_nndr,user_attrs_nndr_norm,user_attrs_objective,user_attrs_privacy_risk,user_attrs_sdv_quality,user_attrs_utility,user_attrs_w_fidelity,user_attrs_w_privacy_risk,user_attrs_w_utility,state
0,0.49161017779541805,2026-09-04 11:42:30.845449,2026-09-04 11:42:33.338820,0 days 00:00:02.493371,truncnorm,True,0.8521199103915611,3.518718522969081,0.0,0.9184512595436067,0.9847826086956523,0.337238357802544,0.978122937921933,0.6408845801193889,0.9949479166666667,0.9769968127609934,0.9769968127609934,0.49161017779541805,0.7043749145050353,,0.662761642197456,0.4,0.2,0.4,COMPLETE
1,0.51907551516002,2026-09-04 11:42:33.339279,2026-09-04 11:42:34.303721,0 days 00:00:00.964442,uniform,True,0.8524977358623977,3.520168094648414,0.0,0.9168466940181554,0.981195652173913,0.26656184029815594,0.978122937921933,0.7115610976237771,0.9958159722222222,0.9757195149040423,0.9757195149040423,0.51907551516002,0.7051921316398984,,0.733438159701844,0.4,0.2,0.4,COMPLETE
2,0.529910145149434,2026-09-04 11:42:34.303947,2026-09-04 11:42:37.396925,0 days 00:00:03.092978,gamma,False,0.8514164379530903,3.4469645814509087,0.0,0.8962245233243713,0.9410326086956523,0.22124373905924374,0.978122937921933,0.7568791988626892,0.9874479166666665,0.9777103851674933,0.9777103851674933,0.529910145149434,0.7004108427830853,,0.7787562609407562,0.4,0.2,0.4,COMPLETE
3,0.51907551516002,2026-09-04 11:42:37.397197,2026-09-04 11:42:38.513604,0 days 00:00:01.116407,uniform,False,0.8524977358623977,3.520168094648414,0.0,0.9168466940181554,0.981195652173913,0.26656184029815594,0.978122937921933,0.7115610976237771,0.9958159722222222,0.9757195149040423,0.9757195149040423,0.51907551516002,0.7051921316398984,,0.733438159701844,0.4,0.2,0.4,COMPLETE
4,0.5363557703934286,2026-09-04 11:42:38.513823,2026-09-04 11:42:39.417513,0 days 00:00:00.903690,norm,False,0.8524955159491878,3.430384907811643,0.0,0.897171671018072,0.9418478260869563,0.20513353911672552,0.978122937921933,0.7729893988052075,0.99140625,0.9780190438814992,0.9780190438814992,0.5363557703934286,0.7022974118355503,,0.7948664608832745,0.4,0.2,0.4,COMPLETE
5,0.4698673790177518,2026-09-04 11:42:39.417862,2026-09-04 11:42:41.625323,0 days 00:00:02.207461,beta,False,0.850867160965155,3.64723522686716,0.0,0.9178792326564906,0.9848913043478261,0.3912148475655666,0.978122937921933,0.5869080903563663,0.9946006944444444,0.9776949070971102,0.9776949070971102,0.4698673790177518,0.7039918750930891,,0.6087851524344334,0.4,0.2,0.4,COMPLETE
6,0.49161017779541805,2026-09-04 11:42:41.625752,2026-09-04 11:42:42.879532,0 days 00:00:01.253780,truncnorm,False,0.8521199103915611,3.518718522969081,0.0,0.9184512595436067,0.9847826086956523,0.337238357802544,0.978122937921933,0.6408845801193889,0.9949479166666667,0.9769968127609934,0.9769968127609934,0.49161017779541805,0.7043749145050353,,0.662761642197456,0.4,0.2,0.4,COMPLETE
7,0.49161017779541805,2026-09-04 11:42:42.879738,2026-09-04 11:42:44.304111,0 days 00:00:01.424373,truncnorm,False,0.8521199103915611,3.518718522969081,0.0,0.9184512595436067,0.9847826086956523,0.337238357802544,0.978122937921933,0.6408845801193889,0.9949479166666667,0.9769968127609934,0.9769968127609934,0.49161017779541805,0.7043749145050353,,0.662761642197456,0.4,0.2,0.4,COMPLETE
8,0.51907551516002,2026-09-04 11:42:44.304312,2026-09-04 11:42:45.472396,0 days 00:00:01.168084,uniform,False,0.8524977358623977,3.520168094648414,0.0,0.9168466940181554,0.981195652173913,0.26656184029815594,0.978122937921933,0.7115610976237771,0.9958159722222222,0.9757195149040423,0.9757195149040423,0.51907551516002,0.7051921316398984,,0.733438159701844,0.4,0.2,0.4,COMPLETE
9,0.51907551516002,2026-09-04 11:42:45.472678,2026-09-04 11:42:46.722724,0 days 00:00:01.250046,uniform,False,0.8524977358623977,3.520168094648414,0.0,0.9168466940181554,0.981195652173913,0.26656184029815594,0.978122937921933,0.7115610976237771,0.9958159722222222,0.9757195149040423,0.9757195149040423,0.51907551516002,0.7051921316398984,,0.733438159701844,0.4,0.2,0.4,COMPLETE
10,0.5363557703934286,2026-09-04 11:42:46.723105,2026-09-04 11:42:47.612095,0 days 00:00:00.888990,norm,True,0.8524955159491878,3.430384907811643,0.0,0.897171671018072,0.9418478260869563,0.20513353911672552,0.978122937921933,0.7729893988052075,0.99140625,0.9780190438814992,0.9780190438814992,0.5363557703934286,0.7022974118355503,,0.7948664608832745,0.4,0.2,0.4,COMPLETE
11,0.5363557703934286,2026-09-04 11:42:47.612335,2026-09-04 11:42:49.016134,0 days 00:00:01.403799,norm,True,0.8524955159491878,3.430384907811643,0.0,0.897171671018072,0.9418478260869563,0.20513353911672552,0.978122937921933,0.7729893988052075,0.99140625,0.9780190438814992,0.9780190438814992,0.5363557703934286,0.7022974118355503,,0.7948664608832745,0.4,0.2,0.4,COMPLETE
12,0.5363557703934286,2026-09-04 11:42:49.016342,2026-09-04 11:42:50.190633,0 days 00:00:01.174291,norm,True,0.8524955159491878,3.430384907811643,0.0,0.897171671018072,0.9418478260869563,0.20513353911672552,0.978122937921933,0.7729893988052075,0.99140625,0.9780190438814992,0.9780190438814992,0.5363557703934286,0.7022974118355503,,0.7948664608832745,0.4,0.2,0.4,COMPLETE
13,0.5363557703934286,2026-09-04 11:42:50.191001,2026-09-04 11:42:51.157003,0 days 00:00:00.966002,norm,True,0.8524955159491878,3.430384907811643,0.0,0.897171671018072,0.9418478260869563,0.20513353911672552,0.978122937921933,0.7729893988052075,0.99140625,0.9780190438814992,0.9780190438814992,0.5363557703934286,0.7022974118355503,,0.7948664608832745,0.4,0.2,0.4,COMPLETE
14,0.5363557703934286,2026-09-04 11:42:51.157273,2026-09-04 11:42:52.029949,0 days 00:00:00.872676,norm,True,0.8524955159491878,3.430384907811643,0.0,0.897171671018072,0.9418478260869563,0.20513353911672552,0.978122937921933,0.7729893988052075,0.99140625,0.9780190438814992,0.9780190438814992,0.5363557703934286,0.7022974118355503,,0.7948664608832745,0.4,0.2,0.4,COMPLETE
15,0.5363557703934286,2026-09-04 11:42:52.030157,2026-09-04 11:42:53.407745,0 days 00:00:01.377588,norm,True,0.8524955159491878,3.430384907811643,0.0,0.897171671018072,0.9418478260869563,0.20513353911672552,0.978122937921933,0.7729893988052075,0.99140625,0.9780190438814992,0.9780190438814992,0.5363557703934286,0.7022974118355503,,0.7948664608832745,0.4,0.2,0.4,COMPLETE
16,0.4698673790177518,2026-09-04 11:42:53.408110,2026-09-04 11:42:55.328090,0 days 00:00:01.919980,beta,True,0.850867160965155,3.64723522686716,0.0,0.9178792326564906,0.9848913043478261,0.3912148475655666,0.978122937921933,0.5869080903563663,0.9946006944444444,0.9776949070971102,0.9776949070971102,0.4698673790177518,0.7039918750930891,,0.6087851524344334,0.4,0.2,0.4,COMPLETE
17,0.529910145149434,2026-09-04 11:42:55.328424,2026-09-04 11:42:56.873040,0 days 00:00:01.544616,gamma,False,0.8514164379530903,3.4469645814509087,0.0,0.8962245233243713,0.9410326086956523,0.22124373905924374,0.978122937921933,0.7568791988626892,0.9874479166666665,0.9777103851674933,0.9777103851674933,0.529910145149434,0.7004108427830853,,0.7787562609407562,0.4,0.2,0.4,COMPLETE
18,0.5363557703934286,2026-09-04 11:42:56.873255,2026-09-04 11:42:57.756203,0 days 00:00:00.882948,norm,True,0.8524955159491878,3.430384907811643,0.0,0.897171671018072,0.9418478260869563,0.20513353911672552,0.978122937921933,0.7729893988052075,0.99140625,0.9780190438814992,0.9780190438814992,0.5363557703934286,0.7022974118355503,,0.7948664608832745,0.4,0.2,0.4,COMPLETE
19,0.5363557703934286,2026-09-04 11:42:57.756438,2026-09-04 11:42:59.222886,0 days 00:00:01.466448,norm,False,0.8524955159491878,3.430384907811643,0.0,0.897171671018072,0.9418478260869563,0.20513353911672552,0.978122937921933,0.7729893988052075,0.99140625,0.9780190438814992,0.9780190438814992,0.5363557703934286,0.7022974118355503,,0.7948664608832745,0.4,0.2,0.4,COMPLETE
