number,value,datetime_start,datetime_complete,duration,params_default_distribution,params_enforce_min_max_values,user_attrs_corr_similarity,user_attrs_dcr,user_attrs_dcr_norm,user_attrs_fidelity,user_attrs_ks_similarity,user_attrs_mean_f1_gap,user_attrs_mean_trtr_f1,user_attrs_mean_tstr_f1,user_attrs_mia_auc,user_attrs_nndr,user_attrs_nndr_norm,user_attrs_objective,user_attrs_privacy_risk,user_attrs_sdv_quality,user_attrs_utility,user_attrs_w_fidelity,user_attrs_w_privacy_risk,user_attrs_w_utility,state
0,0.5826284893491221,2026-08-19 14:03:19.492509,2026-08-19 14:03:20.184359,0 days 00:00:00.691850,truncnorm,True,0.8842127033887428,1.7748863964068193,0.0,0.8637253687197488,0.8432380340507547,0.05872708093755156,0.9411162314388121,0.8823891505012605,0.9487889273356401,0.9251344494967875,0.9251344494967875,0.5826284893491221,0.6968541288187838,,0.9412729190624485,0.4,0.2,0.4,COMPLETE
1,0.3710527045377058,2026-08-19 14:03:20.184819,2026-08-19 14:03:20.897878,0 days 00:00:00.713059,uniform,True,0.8694058025050572,3.4463290921335035,0.0,0.8025153008670484,0.7356247992290396,0.5167406363315096,0.9411162314388121,0.42437559510730244,0.9965397923875433,0.9399469660374095,0.9399469660374095,0.3710527045377058,0.7162858063825488,,0.4832593636684904,0.4,0.2,0.4,COMPLETE
2,0.5883735637983201,2026-08-19 14:03:20.898169,2026-08-19 14:03:21.884794,0 days 00:00:00.986625,gamma,False,0.8905922594068181,1.8214008037365381,0.0,0.8754278354534892,0.8602634115001604,0.04740793256922282,0.9411162314388121,0.8937082988695892,0.984636678200692,0.9271545077447121,0.9271545077447121,0.5883735637983201,0.7141719867769323,,0.9525920674307772,0.4,0.2,0.4,COMPLETE
3,0.3710527045377058,2026-08-19 14:03:21.885097,2026-08-19 14:03:22.662319,0 days 00:00:00.777222,uniform,False,0.8694058025050572,3.4463290921335035,0.0,0.8025153008670484,0.7356247992290396,0.5167406363315096,0.9411162314388121,0.42437559510730244,0.9965397923875433,0.9399469660374095,0.9399469660374095,0.3710527045377058,0.7162858063825488,,0.4832593636684904,0.4,0.2,0.4,COMPLETE
4,0.5719156846495091,2026-08-19 14:03:22.663010,2026-08-19 14:03:23.536773,0 days 00:00:00.873763,norm,False,0.8905702897251377,1.8744308399230845,0.0,0.8876237250103363,0.8846771602955349,0.09728864492284435,0.9411162314388121,0.8438275865159678,0.9976470588235294,0.9257726416144215,0.9257726416144215,0.5719156846495091,0.7210917369274383,,0.9027113550771556,0.4,0.2,0.4,COMPLETE
5,0.5047903093303256,2026-08-19 14:03:23.537782,2026-08-19 14:03:24.772323,0 days 00:00:01.234541,beta,False,0.8729584964662942,1.7615117630930535,0.0,0.8648441695309306,0.856729842595567,0.24606081796907628,0.9411162314388121,0.6950554134697358,0.9833910034602076,0.9269344841934101,0.9269344841934101,0.5047903093303256,0.7136151564720807,,0.7539391820309237,0.4,0.2,0.4,COMPLETE
6,0.5826284893491221,2026-08-19 14:03:24.772601,2026-08-19 14:03:25.484492,0 days 00:00:00.711891,truncnorm,False,0.8842127033887428,1.7748863964068193,0.0,0.8637253687197488,0.8432380340507547,0.05872708093755156,0.9411162314388121,0.8823891505012605,0.9487889273356401,0.9251344494967875,0.9251344494967875,0.5826284893491221,0.6968541288187838,,0.9412729190624485,0.4,0.2,0.4,COMPLETE
7,0.5826284893491221,2026-08-19 14:03:25.484763,2026-08-19 14:03:26.191402,0 days 00:00:00.706639,truncnorm,False,0.8842127033887428,1.7748863964068193,0.0,0.8637253687197488,0.8432380340507547,0.05872708093755156,0.9411162314388121,0.8823891505012605,0.9487889273356401,0.9251344494967875,0.9251344494967875,0.5826284893491221,0.6968541288187838,,0.9412729190624485,0.4,0.2,0.4,COMPLETE
8,0.3710527045377058,2026-08-19 14:03:26.191638,2026-08-19 14:03:26.827970,0 days 00:00:00.636332,uniform,False,0.8694058025050572,3.4463290921335035,0.0,0.8025153008670484,0.7356247992290396,0.5167406363315096,0.9411162314388121,0.42437559510730244,0.9965397923875433,0.9399469660374095,0.9399469660374095,0.3710527045377058,0.7162858063825488,,0.4832593636684904,0.4,0.2,0.4,COMPLETE
9,0.3710527045377058,2026-08-19 14:03:26.828297,2026-08-19 14:03:27.467007,0 days 00:00:00.638710,uniform,False,0.8694058025050572,3.4463290921335035,0.0,0.8025153008670484,0.7356247992290396,0.5167406363315096,0.9411162314388121,0.42437559510730244,0.9965397923875433,0.9399469660374095,0.9399469660374095,0.3710527045377058,0.7162858063825488,,0.4832593636684904,0.4,0.2,0.4,COMPLETE
10,0.5937711124539753,2026-08-19 14:03:27.467216,2026-08-19 14:03:28.509830,0 days 00:00:01.042614,gamma,True,0.8918293752705594,1.745597209868782,0.0,0.87604639338536,0.8602634115001604,0.036695681856972175,0.9411162314388121,0.9044205495818399,0.9727335640138408,0.9217364040667367,0.9217364040667367,0.5937711124539753,0.7098458607868994,,0.9633043181430279,0.4,0.2,0.4,COMPLETE
11,0.5937711124539753,2026-08-19 14:03:28.510560,2026-08-19 14:03:29.762964,0 days 00:00:01.252404,gamma,True,0.8918293752705594,1.745597209868782,0.0,0.87604639338536,0.8602634115001604,0.036695681856972175,0.9411162314388121,0.9044205495818399,0.9727335640138408,0.9217364040667367,0.9217364040667367,0.5937711124539753,0.7098458607868994,,0.9633043181430279,0.4,0.2,0.4,COMPLETE
12,0.5937711124539753,2026-08-19 14:03:29.763347,2026-08-19 14:03:30.870388,0 days 00:00:01.107041,gamma,True,0.8918293752705594,1.745597209868782,0.0,0.87604639338536,0.8602634115001604,0.036695681856972175,0.9411162314388121,0.9044205495818399,0.9727335640138408,0.9217364040667367,0.9217364040667367,0.5937711124539753,0.7098458607868994,,0.9633043181430279,0.4,0.2,0.4,COMPLETE
13,0.5937711124539753,2026-08-19 14:03:30.870757,2026-08-19 14:03:31.741263,0 days 00:00:00.870506,gamma,True,0.8918293752705594,1.745597209868782,0.0,0.87604639338536,0.8602634115001604,0.036695681856972175,0.9411162314388121,0.9044205495818399,0.9727335640138408,0.9217364040667367,0.9217364040667367,0.5937711124539753,0.7098458607868994,,0.9633043181430279,0.4,0.2,0.4,COMPLETE
14,0.5937711124539753,2026-08-19 14:03:31.741563,2026-08-19 14:03:32.665631,0 days 00:00:00.924068,gamma,True,0.8918293752705594,1.745597209868782,0.0,0.87604639338536,0.8602634115001604,0.036695681856972175,0.9411162314388121,0.9044205495818399,0.9727335640138408,0.9217364040667367,0.9217364040667367,0.5937711124539753,0.7098458607868994,,0.9633043181430279,0.4,0.2,0.4,COMPLETE
15,0.5937711124539753,2026-08-19 14:03:32.666332,2026-08-19 14:03:33.639053,0 days 00:00:00.972721,gamma,True,0.8918293752705594,1.745597209868782,0.0,0.87604639338536,0.8602634115001604,0.036695681856972175,0.9411162314388121,0.9044205495818399,0.9727335640138408,0.9217364040667367,0.9217364040667367,0.5937711124539753,0.7098458607868994,,0.9633043181430279,0.4,0.2,0.4,COMPLETE
16,0.5072767675597847,2026-08-19 14:03:33.639341,2026-08-19 14:03:34.728306,0 days 00:00:01.088965,beta,True,0.8726030638284233,1.7615117630930535,0.0,0.8646664532119952,0.856729842595567,0.23966695607649316,0.9411162314388121,0.7014492753623189,0.9833910034602076,0.9269344841934101,0.9269344841934101,0.5072767675597847,0.7136151564720807,,0.7603330439235069,0.4,0.2,0.4,COMPLETE
17,0.5917663404178465,2026-08-19 14:03:34.728770,2026-08-19 14:03:35.412481,0 days 00:00:00.683711,norm,True,0.8930534506408813,1.7552567421518153,0.0,0.8896683893101611,0.8862833279794411,0.06190476190476187,0.9411162314388121,0.8792114695340502,0.941038062283737,0.9127449280676744,0.9127449280676744,0.5917663404178465,0.6966955527215661,,0.9380952380952381,0.4,0.2,0.4,COMPLETE
18,0.5937711124539753,2026-08-19 14:03:35.412742,2026-08-19 14:03:36.395851,0 days 00:00:00.983109,gamma,True,0.8918293752705594,1.745597209868782,0.0,0.87604639338536,0.8602634115001604,0.036695681856972175,0.9411162314388121,0.9044205495818399,0.9727335640138408,0.9217364040667367,0.9217364040667367,0.5937711124539753,0.7098458607868994,,0.9633043181430279,0.4,0.2,0.4,COMPLETE
19,0.5937711124539753,2026-08-19 14:03:36.396273,2026-08-19 14:03:37.371922,0 days 00:00:00.975649,gamma,True,0.8918293752705594,1.745597209868782,0.0,0.87604639338536,0.8602634115001604,0.036695681856972175,0.9411162314388121,0.9044205495818399,0.9727335640138408,0.9217364040667367,0.9217364040667367,0.5937711124539753,0.7098458607868994,,0.9633043181430279,0.4,0.2,0.4,COMPLETE
