number,value,datetime_start,datetime_complete,duration,params_default_distribution,params_enforce_min_max_values,user_attrs_corr_similarity,user_attrs_dcr,user_attrs_dcr_norm,user_attrs_fidelity,user_attrs_ks_similarity,user_attrs_mean_f1_gap,user_attrs_mean_trtr_f1,user_attrs_mean_tstr_f1,user_attrs_mia_auc,user_attrs_nndr,user_attrs_nndr_norm,user_attrs_objective,user_attrs_privacy_risk,user_attrs_sdv_quality,user_attrs_utility,user_attrs_w_fidelity,user_attrs_w_privacy_risk,user_attrs_w_utility,state
0,0.2993631077461194,2026-09-08 11:32:27.152874,2026-09-08 11:32:27.750045,0 days 00:00:00.597171,truncnorm,True,0.9053896400714538,1.479145044627958,0.0,0.9441010700357269,0.9828125,0.8861565840656814,0.9761028444174511,0.08994626035176967,0.789826388888889,0.9194658707831687,0.9194658707831687,0.2993631077461194,0.6190734332094939,,0.11384341593431857,0.4,0.2,0.4,COMPLETE
1,0.320651624015306,2026-09-08 11:32:27.750514,2026-09-08 11:32:28.304536,0 days 00:00:00.554022,uniform,True,0.9098383320410397,1.5011765275385387,0.0,0.9473149993538532,0.9847916666666667,0.8409708023937275,0.9761028444174511,0.13513204202372364,0.7729861111111113,0.9235426057061136,0.9235426057061136,0.320651624015306,0.6094302738437216,,0.15902919760627254,0.4,0.2,0.4,COMPLETE
2,0.2555896757248354,2026-09-08 11:32:28.304994,2026-09-08 11:32:29.250443,0 days 00:00:00.945449,gamma,False,0.9109357890723838,1.4641149903717743,0.0,0.9327595612028585,0.9545833333333333,0.9865386295186307,0.9761028444174511,-0.010435785101179595,0.7856076388888888,0.9277011156672184,0.9277011156672184,0.2555896757248354,0.6144934847442789,,0.013461370481369306,0.4,0.2,0.4,COMPLETE
3,0.320651624015306,2026-09-08 11:32:29.250833,2026-09-08 11:32:29.795861,0 days 00:00:00.545028,uniform,False,0.9098383320410397,1.5011765275385387,0.0,0.9473149993538532,0.9847916666666667,0.8409708023937275,0.9761028444174511,0.13513204202372364,0.7729861111111113,0.9235426057061136,0.9235426057061136,0.320651624015306,0.6094302738437216,,0.15902919760627254,0.4,0.2,0.4,COMPLETE
4,0.3008715069102612,2026-09-08 11:32:29.796263,2026-09-08 11:32:30.296932,0 days 00:00:00.500669,norm,False,0.9085692877661504,1.4830030989403102,0.0,0.9290763105497419,0.9495833333333333,0.8680623415276008,0.9761028444174511,0.10804050288985034,0.7845746527777779,0.9153897429863755,0.9153897429863755,0.3008715069102612,0.6176704034929763,,0.13193765847239924,0.4,0.2,0.4,COMPLETE
5,0.34238162244683173,2026-09-08 11:32:30.297162,2026-09-08 11:32:31.284802,0 days 00:00:00.987640,beta,False,0.9107345612159389,1.494435973430098,0.0,0.9468776972746361,0.9830208333333333,0.7899181154995507,0.9761028444174511,0.1861847289179004,0.7563888888888889,0.9206113104281073,0.9206113104281073,0.34238162244683173,0.6020110513160123,,0.2100818845004493,0.4,0.2,0.4,COMPLETE
6,0.2993631077461194,2026-09-08 11:32:31.285091,2026-09-08 11:32:31.848006,0 days 00:00:00.562915,truncnorm,False,0.9053896400714538,1.479145044627958,0.0,0.9441010700357269,0.9828125,0.8861565840656814,0.9761028444174511,0.08994626035176967,0.789826388888889,0.9194658707831687,0.9194658707831687,0.2993631077461194,0.6190734332094939,,0.11384341593431857,0.4,0.2,0.4,COMPLETE
7,0.2993631077461194,2026-09-08 11:32:31.848444,2026-09-08 11:32:32.398902,0 days 00:00:00.550458,truncnorm,False,0.9053896400714538,1.479145044627958,0.0,0.9441010700357269,0.9828125,0.8861565840656814,0.9761028444174511,0.08994626035176967,0.789826388888889,0.9194658707831687,0.9194658707831687,0.2993631077461194,0.6190734332094939,,0.11384341593431857,0.4,0.2,0.4,COMPLETE
8,0.320651624015306,2026-09-08 11:32:32.399146,2026-09-08 11:32:32.907349,0 days 00:00:00.508203,uniform,False,0.9098383320410397,1.5011765275385387,0.0,0.9473149993538532,0.9847916666666667,0.8409708023937275,0.9761028444174511,0.13513204202372364,0.7729861111111113,0.9235426057061136,0.9235426057061136,0.320651624015306,0.6094302738437216,,0.15902919760627254,0.4,0.2,0.4,COMPLETE
9,0.320651624015306,2026-09-08 11:32:32.907567,2026-09-08 11:32:33.454564,0 days 00:00:00.546997,uniform,False,0.9098383320410397,1.5011765275385387,0.0,0.9473149993538532,0.9847916666666667,0.8409708023937275,0.9761028444174511,0.13513204202372364,0.7729861111111113,0.9235426057061136,0.9235426057061136,0.320651624015306,0.6094302738437216,,0.15902919760627254,0.4,0.2,0.4,COMPLETE
10,0.34238162244683173,2026-09-08 11:32:33.454868,2026-09-08 11:32:34.466808,0 days 00:00:01.011940,beta,True,0.9107345612159389,1.494435973430098,0.0,0.9468776972746361,0.9830208333333333,0.7899181154995507,0.9761028444174511,0.1861847289179004,0.7563888888888889,0.9206113104281073,0.9206113104281073,0.34238162244683173,0.6020110513160123,,0.2100818845004493,0.4,0.2,0.4,COMPLETE
11,0.34238162244683173,2026-09-08 11:32:34.467298,2026-09-08 11:32:35.514360,0 days 00:00:01.047062,beta,True,0.9107345612159389,1.494435973430098,0.0,0.9468776972746361,0.9830208333333333,0.7899181154995507,0.9761028444174511,0.1861847289179004,0.7563888888888889,0.9206113104281073,0.9206113104281073,0.34238162244683173,0.6020110513160123,,0.2100818845004493,0.4,0.2,0.4,COMPLETE
12,0.34238162244683173,2026-09-08 11:32:35.514586,2026-09-08 11:32:36.520545,0 days 00:00:01.005959,beta,True,0.9107345612159389,1.494435973430098,0.0,0.9468776972746361,0.9830208333333333,0.7899181154995507,0.9761028444174511,0.1861847289179004,0.7563888888888889,0.9206113104281073,0.9206113104281073,0.34238162244683173,0.6020110513160123,,0.2100818845004493,0.4,0.2,0.4,COMPLETE
13,0.34238162244683173,2026-09-08 11:32:36.520882,2026-09-08 11:32:37.516825,0 days 00:00:00.995943,beta,True,0.9107345612159389,1.494435973430098,0.0,0.9468776972746361,0.9830208333333333,0.7899181154995507,0.9761028444174511,0.1861847289179004,0.7563888888888889,0.9206113104281073,0.9206113104281073,0.34238162244683173,0.6020110513160123,,0.2100818845004493,0.4,0.2,0.4,COMPLETE
14,0.34238162244683173,2026-09-08 11:32:37.517049,2026-09-08 11:32:38.753645,0 days 00:00:01.236596,beta,True,0.9107345612159389,1.494435973430098,0.0,0.9468776972746361,0.9830208333333333,0.7899181154995507,0.9761028444174511,0.1861847289179004,0.7563888888888889,0.9206113104281073,0.9206113104281073,0.34238162244683173,0.6020110513160123,,0.2100818845004493,0.4,0.2,0.4,COMPLETE
15,0.34238162244683173,2026-09-08 11:32:38.753878,2026-09-08 11:32:39.804967,0 days 00:00:01.051089,beta,True,0.9107345612159389,1.494435973430098,0.0,0.9468776972746361,0.9830208333333333,0.7899181154995507,0.9761028444174511,0.1861847289179004,0.7563888888888889,0.9206113104281073,0.9206113104281073,0.34238162244683173,0.6020110513160123,,0.2100818845004493,0.4,0.2,0.4,COMPLETE
16,0.3008715069102612,2026-09-08 11:32:39.805326,2026-09-08 11:32:40.348872,0 days 00:00:00.543546,norm,True,0.9085692877661504,1.4830030989403102,0.0,0.9290763105497419,0.9495833333333333,0.8680623415276008,0.9761028444174511,0.10804050288985034,0.7845746527777779,0.9153897429863755,0.9153897429863755,0.3008715069102612,0.6176704034929763,,0.13193765847239924,0.4,0.2,0.4,COMPLETE
17,0.2555896757248354,2026-09-08 11:32:40.349106,2026-09-08 11:32:41.239022,0 days 00:00:00.889916,gamma,False,0.9109357890723838,1.4641149903717743,0.0,0.9327595612028585,0.9545833333333333,0.9865386295186307,0.9761028444174511,-0.010435785101179595,0.7856076388888888,0.9277011156672184,0.9277011156672184,0.2555896757248354,0.6144934847442789,,0.013461370481369306,0.4,0.2,0.4,COMPLETE
18,0.34238162244683173,2026-09-08 11:32:41.239359,2026-09-08 11:32:42.454554,0 days 00:00:01.215195,beta,True,0.9107345612159389,1.494435973430098,0.0,0.9468776972746361,0.9830208333333333,0.7899181154995507,0.9761028444174511,0.1861847289179004,0.7563888888888889,0.9206113104281073,0.9206113104281073,0.34238162244683173,0.6020110513160123,,0.2100818845004493,0.4,0.2,0.4,COMPLETE
19,0.34238162244683173,2026-09-08 11:32:42.454776,2026-09-08 11:32:43.475701,0 days 00:00:01.020925,beta,False,0.9107345612159389,1.494435973430098,0.0,0.9468776972746361,0.9830208333333333,0.7899181154995507,0.9761028444174511,0.1861847289179004,0.7563888888888889,0.9206113104281073,0.9206113104281073,0.34238162244683173,0.6020110513160123,,0.2100818845004493,0.4,0.2,0.4,COMPLETE
