number,value,datetime_start,datetime_complete,duration,params_default_distribution,params_enforce_min_max_values,user_attrs_corr_similarity,user_attrs_dcr,user_attrs_dcr_norm,user_attrs_fidelity,user_attrs_ks_similarity,user_attrs_mean_f1_gap,user_attrs_mean_trtr_f1,user_attrs_mean_tstr_f1,user_attrs_mia_auc,user_attrs_nndr,user_attrs_nndr_norm,user_attrs_objective,user_attrs_privacy_risk,user_attrs_sdv_quality,user_attrs_utility,user_attrs_w_fidelity,user_attrs_w_privacy_risk,user_attrs_w_utility,state
0,0.6025305772713276,2026-09-02 19:00:39.598258,2026-09-02 19:00:40.741079,0 days 00:00:01.142821,truncnorm,True,0.9139809572892714,2.7593685672550423,0.0,0.9209393422809993,0.9278977272727271,0.0676835469097226,0.7592015668055841,0.6915180198958614,0.9426388888888889,0.9248691335284301,0.9248691335284301,0.6025305772713276,0.6938587043859155,,0.9323164530902774,0.4,0.2,0.4,COMPLETE
1,0.5873638641406902,2026-09-02 19:00:40.741663,2026-09-02 19:00:41.705140,0 days 00:00:00.963477,uniform,True,0.9155473842390989,4.130995653235434,0.0,0.9058418739377314,0.8961363636363638,0.08507473038036051,0.7592015668055841,0.6741268364252235,0.9776215277777778,0.9469859915919918,0.9469859915919918,0.5873638641406902,0.7047149664112913,,0.9149252696196395,0.4,0.2,0.4,COMPLETE
2,0.6226359122121605,2026-09-02 19:00:41.705437,2026-09-02 19:00:43.172639,0 days 00:00:01.467202,gamma,False,0.9120355562041205,2.586890094292217,0.0,0.9270973235566056,0.9421590909090907,0.0602540176472787,0.7592015668055841,0.6989475491583054,0.7909895833333334,0.9166258030293842,0.9166258030293842,0.6226359122121605,0.6205070507578514,,0.9397459823527213,0.4,0.2,0.4,COMPLETE
3,0.5873638641406902,2026-09-02 19:00:43.172958,2026-09-02 19:00:44.232584,0 days 00:00:01.059626,uniform,False,0.9155473842390989,4.130995653235434,0.0,0.9058418739377314,0.8961363636363638,0.08507473038036051,0.7592015668055841,0.6741268364252235,0.9776215277777778,0.9469859915919918,0.9469859915919918,0.5873638641406902,0.7047149664112913,,0.9149252696196395,0.4,0.2,0.4,COMPLETE
4,0.6071885369399298,2026-09-02 19:00:44.232920,2026-09-02 19:00:45.079289,0 days 00:00:00.846369,norm,False,0.9196822861391492,2.7297365522354786,0.0,0.9278240976150292,0.935965909090909,0.05699566423791532,0.7592015668055841,0.7022059025676688,0.9647569444444444,0.9222143005588098,0.9222143005588098,0.6071885369399298,0.7057141820545791,,0.9430043357620846,0.4,0.2,0.4,COMPLETE
5,0.6267177921355539,2026-09-02 19:00:45.079683,2026-09-02 19:00:46.740309,0 days 00:00:01.660626,beta,False,0.909154925500938,2.7502556838882226,0.0,0.94111155365956,0.9730681818181819,0.08007925502443632,0.7592015668055841,0.6791223117811477,0.7298350694444444,0.9214729937658157,0.9214729937658157,0.6267177921355539,0.5884756365924775,,0.9199207449755636,0.4,0.2,0.4,COMPLETE
6,0.6025305772713276,2026-09-02 19:00:46.740581,2026-09-02 19:00:47.673802,0 days 00:00:00.933221,truncnorm,False,0.9139809572892714,2.7593685672550423,0.0,0.9209393422809993,0.9278977272727271,0.0676835469097226,0.7592015668055841,0.6915180198958614,0.9426388888888889,0.9248691335284301,0.9248691335284301,0.6025305772713276,0.6938587043859155,,0.9323164530902774,0.4,0.2,0.4,COMPLETE
7,0.6025305772713276,2026-09-02 19:00:47.674130,2026-09-02 19:00:48.663613,0 days 00:00:00.989483,truncnorm,False,0.9139809572892714,2.7593685672550423,0.0,0.9209393422809993,0.9278977272727271,0.0676835469097226,0.7592015668055841,0.6915180198958614,0.9426388888888889,0.9248691335284301,0.9248691335284301,0.6025305772713276,0.6938587043859155,,0.9323164530902774,0.4,0.2,0.4,COMPLETE
8,0.5873638641406902,2026-09-02 19:00:48.663942,2026-09-02 19:00:49.675489,0 days 00:00:01.011547,uniform,False,0.9155473842390989,4.130995653235434,0.0,0.9058418739377314,0.8961363636363638,0.08507473038036051,0.7592015668055841,0.6741268364252235,0.9776215277777778,0.9469859915919918,0.9469859915919918,0.5873638641406902,0.7047149664112913,,0.9149252696196395,0.4,0.2,0.4,COMPLETE
9,0.5873638641406902,2026-09-02 19:00:49.675988,2026-09-02 19:00:50.559345,0 days 00:00:00.883357,uniform,False,0.9155473842390989,4.130995653235434,0.0,0.9058418739377314,0.8961363636363638,0.08507473038036051,0.7592015668055841,0.6741268364252235,0.9776215277777778,0.9469859915919918,0.9469859915919918,0.5873638641406902,0.7047149664112913,,0.9149252696196395,0.4,0.2,0.4,COMPLETE
10,0.6267177921355539,2026-09-02 19:00:50.559606,2026-09-02 19:00:52.219680,0 days 00:00:01.660074,beta,True,0.909154925500938,2.7502556838882226,0.0,0.94111155365956,0.9730681818181819,0.08007925502443632,0.7592015668055841,0.6791223117811477,0.7298350694444444,0.9214729937658157,0.9214729937658157,0.6267177921355539,0.5884756365924775,,0.9199207449755636,0.4,0.2,0.4,COMPLETE
11,0.6267177921355539,2026-09-02 19:00:52.220072,2026-09-02 19:00:53.851525,0 days 00:00:01.631453,beta,True,0.909154925500938,2.7502556838882226,0.0,0.94111155365956,0.9730681818181819,0.08007925502443632,0.7592015668055841,0.6791223117811477,0.7298350694444444,0.9214729937658157,0.9214729937658157,0.6267177921355539,0.5884756365924775,,0.9199207449755636,0.4,0.2,0.4,COMPLETE
12,0.6267177921355539,2026-09-02 19:00:53.851834,2026-09-02 19:00:55.556705,0 days 00:00:01.704871,beta,True,0.909154925500938,2.7502556838882226,0.0,0.94111155365956,0.9730681818181819,0.08007925502443632,0.7592015668055841,0.6791223117811477,0.7298350694444444,0.9214729937658157,0.9214729937658157,0.6267177921355539,0.5884756365924775,,0.9199207449755636,0.4,0.2,0.4,COMPLETE
13,0.6267177921355539,2026-09-02 19:00:55.557140,2026-09-02 19:00:57.316178,0 days 00:00:01.759038,beta,True,0.909154925500938,2.7502556838882226,0.0,0.94111155365956,0.9730681818181819,0.08007925502443632,0.7592015668055841,0.6791223117811477,0.7298350694444444,0.9214729937658157,0.9214729937658157,0.6267177921355539,0.5884756365924775,,0.9199207449755636,0.4,0.2,0.4,COMPLETE
14,0.6267177921355539,2026-09-02 19:00:57.316444,2026-09-02 19:00:58.949220,0 days 00:00:01.632776,beta,True,0.909154925500938,2.7502556838882226,0.0,0.94111155365956,0.9730681818181819,0.08007925502443632,0.7592015668055841,0.6791223117811477,0.7298350694444444,0.9214729937658157,0.9214729937658157,0.6267177921355539,0.5884756365924775,,0.9199207449755636,0.4,0.2,0.4,COMPLETE
15,0.6267177921355539,2026-09-02 19:00:58.949502,2026-09-02 19:01:00.582391,0 days 00:00:01.632889,beta,True,0.909154925500938,2.7502556838882226,0.0,0.94111155365956,0.9730681818181819,0.08007925502443632,0.7592015668055841,0.6791223117811477,0.7298350694444444,0.9214729937658157,0.9214729937658157,0.6267177921355539,0.5884756365924775,,0.9199207449755636,0.4,0.2,0.4,COMPLETE
16,0.6179351146848608,2026-09-02 19:01:00.582798,2026-09-02 19:01:01.421032,0 days 00:00:00.838234,norm,True,0.9189957032490701,2.6264960099656003,0.0,0.928219442533626,0.9374431818181819,0.06418684415855502,0.7592015668055841,0.695014722647029,0.8244791666666667,0.9128332000249844,0.9128332000249844,0.6179351146848608,0.638389623325838,,0.935813155841445,0.4,0.2,0.4,COMPLETE
17,0.6226359122121605,2026-09-02 19:01:01.421221,2026-09-02 19:01:02.822140,0 days 00:00:01.400919,gamma,False,0.9120355562041205,2.586890094292217,0.0,0.9270973235566056,0.9421590909090907,0.0602540176472787,0.7592015668055841,0.6989475491583054,0.7909895833333334,0.9166258030293842,0.9166258030293842,0.6226359122121605,0.6205070507578514,,0.9397459823527213,0.4,0.2,0.4,COMPLETE
18,0.6267177921355539,2026-09-02 19:01:02.822422,2026-09-02 19:01:04.426167,0 days 00:00:01.603745,beta,True,0.909154925500938,2.7502556838882226,0.0,0.94111155365956,0.9730681818181819,0.08007925502443632,0.7592015668055841,0.6791223117811477,0.7298350694444444,0.9214729937658157,0.9214729937658157,0.6267177921355539,0.5884756365924775,,0.9199207449755636,0.4,0.2,0.4,COMPLETE
19,0.6267177921355539,2026-09-02 19:01:04.426497,2026-09-02 19:01:06.021676,0 days 00:00:01.595179,beta,False,0.909154925500938,2.7502556838882226,0.0,0.94111155365956,0.9730681818181819,0.08007925502443632,0.7592015668055841,0.6791223117811477,0.7298350694444444,0.9214729937658157,0.9214729937658157,0.6267177921355539,0.5884756365924775,,0.9199207449755636,0.4,0.2,0.4,COMPLETE
