number,value,datetime_start,datetime_complete,duration,params_default_distribution,params_enforce_min_max_values,user_attrs_corr_similarity,user_attrs_dcr,user_attrs_dcr_norm,user_attrs_fidelity,user_attrs_ks_similarity,user_attrs_mean_f1_gap,user_attrs_mean_trtr_f1,user_attrs_mean_tstr_f1,user_attrs_mia_auc,user_attrs_nndr,user_attrs_nndr_norm,user_attrs_objective,user_attrs_privacy_risk,user_attrs_sdv_quality,user_attrs_utility,user_attrs_w_fidelity,user_attrs_w_privacy_risk,user_attrs_w_utility,state
0,0.332624099382695,2026-09-09 14:50:28.553121,2026-09-09 14:50:30.740246,0 days 00:00:02.187125,truncnorm,True,0.6564221402198239,9449.466899337807,0.0,0.6514739099890661,0.6465256797583082,0.46990838968828874,-0.25524275807532115,-0.7251511477636099,1.0,0.999964854373067,0.999964854373067,0.332624099382695,0.7000105436880799,,0.5300916103117113,0.4,0.2,0.4,COMPLETE
1,0.11285812258821099,2026-09-09 14:50:30.740722,2026-09-09 14:50:31.034883,0 days 00:00:00.294161,uniform,True,0.6555398301107234,9449.466345599083,0.0,0.6321505797079296,0.608761329305136,1.3186102580116605,-0.25524275807532115,-1.5738530160869817,1.0,0.9999648450839859,0.9999648450839859,0.11285812258821099,0.7000105464748043,,0.0,0.4,0.2,0.4,COMPLETE
2,0.5315075120576751,2026-09-09 14:50:31.035134,2026-09-09 14:50:31.394843,0 days 00:00:00.359709,gamma,False,0.6531170864459297,9449.466967476104,0.0,0.6787740517828843,0.7044310171198389,-0.10020544180402813,-0.25524275807532115,-0.15503731627129302,1.0,0.9999648557420232,0.9999648557420232,0.5315075120576751,0.7000105432773931,,1.0,0.4,0.2,0.4,COMPLETE
3,0.11285812258821099,2026-09-09 14:50:31.395245,2026-09-09 14:50:31.687783,0 days 00:00:00.292538,uniform,False,0.6555398301107234,9449.466345599083,0.0,0.6321505797079296,0.608761329305136,1.3186102580116605,-0.25524275807532115,-1.5738530160869817,1.0,0.9999648450839859,0.9999648450839859,0.11285812258821099,0.7000105464748043,,0.0,0.4,0.2,0.4,COMPLETE
4,0.4798366393587421,2026-09-09 14:50:31.688026,2026-09-09 14:50:31.971871,0 days 00:00:00.283845,norm,False,0.6597612888304774,9449.467024489284,0.0,0.6690045114847252,0.6782477341389729,0.11940764097363665,-0.25524275807532115,-0.3746503990489578,1.0,0.999964852571779,0.999964852571779,0.4798366393587421,0.7000105442284663,,0.8805923590263633,0.4,0.2,0.4,COMPLETE
5,0.49601696336468937,2026-09-09 14:50:31.972112,2026-09-09 14:50:32.409452,0 days 00:00:00.437340,beta,False,0.659313764685973,9449.46710886826,0.0,0.6690325117488274,0.6787512588116819,0.07898483129545619,-0.25524275807532115,-0.33422758937077734,1.0,0.9999648530556802,0.9999648530556802,0.49601696336468937,0.700010544083296,,0.9210151687045438,0.4,0.2,0.4,COMPLETE
6,0.332624099382695,2026-09-09 14:50:32.409765,2026-09-09 14:50:32.711909,0 days 00:00:00.302144,truncnorm,False,0.6564221402198239,9449.466899337807,0.0,0.6514739099890661,0.6465256797583082,0.46990838968828874,-0.25524275807532115,-0.7251511477636099,1.0,0.999964854373067,0.999964854373067,0.332624099382695,0.7000105436880799,,0.5300916103117113,0.4,0.2,0.4,COMPLETE
7,0.332624099382695,2026-09-09 14:50:32.712126,2026-09-09 14:50:33.019127,0 days 00:00:00.307001,truncnorm,False,0.6564221402198239,9449.466899337807,0.0,0.6514739099890661,0.6465256797583082,0.46990838968828874,-0.25524275807532115,-0.7251511477636099,1.0,0.999964854373067,0.999964854373067,0.332624099382695,0.7000105436880799,,0.5300916103117113,0.4,0.2,0.4,COMPLETE
8,0.11285812258821099,2026-09-09 14:50:33.019339,2026-09-09 14:50:33.317722,0 days 00:00:00.298383,uniform,False,0.6555398301107234,9449.466345599083,0.0,0.6321505797079296,0.608761329305136,1.3186102580116605,-0.25524275807532115,-1.5738530160869817,1.0,0.9999648450839859,0.9999648450839859,0.11285812258821099,0.7000105464748043,,0.0,0.4,0.2,0.4,COMPLETE
9,0.11285812258821099,2026-09-09 14:50:33.318087,2026-09-09 14:50:33.618089,0 days 00:00:00.300002,uniform,False,0.6555398301107234,9449.466345599083,0.0,0.6321505797079296,0.608761329305136,1.3186102580116605,-0.25524275807532115,-1.5738530160869817,1.0,0.9999648450839859,0.9999648450839859,0.11285812258821099,0.7000105464748043,,0.0,0.4,0.2,0.4,COMPLETE
10,0.5313991711190058,2026-09-09 14:50:33.618333,2026-09-09 14:50:33.995100,0 days 00:00:00.376767,gamma,True,0.652575381752583,9449.466967476104,0.0,0.678503199436211,0.7044310171198389,-0.10545170801176051,-0.25524275807532115,-0.14979105006356064,1.0,0.9999648557420232,0.9999648557420232,0.5313991711190058,0.7000105432773931,,1.0,0.4,0.2,0.4,COMPLETE
11,0.5313991711190058,2026-09-09 14:50:33.995347,2026-09-09 14:50:34.369152,0 days 00:00:00.373805,gamma,True,0.652575381752583,9449.466967476104,0.0,0.678503199436211,0.7044310171198389,-0.10545170801176051,-0.25524275807532115,-0.14979105006356064,1.0,0.9999648557420232,0.9999648557420232,0.5313991711190058,0.7000105432773931,,1.0,0.4,0.2,0.4,COMPLETE
12,0.5313991711190058,2026-09-09 14:50:34.369374,2026-09-09 14:50:34.744564,0 days 00:00:00.375190,gamma,True,0.652575381752583,9449.466967476104,0.0,0.678503199436211,0.7044310171198389,-0.10545170801176051,-0.25524275807532115,-0.14979105006356064,1.0,0.9999648557420232,0.9999648557420232,0.5313991711190058,0.7000105432773931,,1.0,0.4,0.2,0.4,COMPLETE
13,0.5313991711190058,2026-09-09 14:50:34.744869,2026-09-09 14:50:35.118389,0 days 00:00:00.373520,gamma,True,0.652575381752583,9449.466967476104,0.0,0.678503199436211,0.7044310171198389,-0.10545170801176051,-0.25524275807532115,-0.14979105006356064,1.0,0.9999648557420232,0.9999648557420232,0.5313991711190058,0.7000105432773931,,1.0,0.4,0.2,0.4,COMPLETE
14,0.5313991711190058,2026-09-09 14:50:35.118606,2026-09-09 14:50:35.491180,0 days 00:00:00.372574,gamma,True,0.652575381752583,9449.466967476104,0.0,0.678503199436211,0.7044310171198389,-0.10545170801176051,-0.25524275807532115,-0.14979105006356064,1.0,0.9999648557420232,0.9999648557420232,0.5313991711190058,0.7000105432773931,,1.0,0.4,0.2,0.4,COMPLETE
15,0.5313991711190058,2026-09-09 14:50:35.491395,2026-09-09 14:50:35.867424,0 days 00:00:00.376029,gamma,True,0.652575381752583,9449.466967476104,0.0,0.678503199436211,0.7044310171198389,-0.10545170801176051,-0.25524275807532115,-0.14979105006356064,1.0,0.9999648557420232,0.9999648557420232,0.5313991711190058,0.7000105432773931,,1.0,0.4,0.2,0.4,COMPLETE
16,0.4960234747036576,2026-09-09 14:50:35.867822,2026-09-09 14:50:36.307252,0 days 00:00:00.439430,beta,True,0.6593463213808145,9449.46710886826,0.0,0.6690487900962482,0.6787512588116819,0.07898483129545619,-0.25524275807532115,-0.33422758937077734,1.0,0.9999648530556802,0.9999648530556802,0.4960234747036576,0.700010544083296,,0.9210151687045438,0.4,0.2,0.4,COMPLETE
17,0.4798366393587421,2026-09-09 14:50:36.307474,2026-09-09 14:50:36.596979,0 days 00:00:00.289505,norm,False,0.6597612888304774,9449.467024489284,0.0,0.6690045114847252,0.6782477341389729,0.11940764097363665,-0.25524275807532115,-0.3746503990489578,1.0,0.999964852571779,0.999964852571779,0.4798366393587421,0.7000105442284663,,0.8805923590263633,0.4,0.2,0.4,COMPLETE
18,0.5313991711190058,2026-09-09 14:50:36.597217,2026-09-09 14:50:36.970661,0 days 00:00:00.373444,gamma,True,0.652575381752583,9449.466967476104,0.0,0.678503199436211,0.7044310171198389,-0.10545170801176051,-0.25524275807532115,-0.14979105006356064,1.0,0.9999648557420232,0.9999648557420232,0.5313991711190058,0.7000105432773931,,1.0,0.4,0.2,0.4,COMPLETE
19,0.5315075120576751,2026-09-09 14:50:36.970907,2026-09-09 14:50:37.340370,0 days 00:00:00.369463,gamma,False,0.6531170864459297,9449.466967476104,0.0,0.6787740517828843,0.7044310171198389,-0.10020544180402813,-0.25524275807532115,-0.15503731627129302,1.0,0.9999648557420232,0.9999648557420232,0.5315075120576751,0.7000105432773931,,1.0,0.4,0.2,0.4,COMPLETE
