number,value,datetime_start,datetime_complete,duration,params_diffusion_type,params_duplicate_K,params_eta,params_max_depth,params_n_estimators,params_n_t,user_attrs_corr_similarity,user_attrs_dcr,user_attrs_dcr_norm,user_attrs_fidelity,user_attrs_ks_similarity,user_attrs_mean_f1_gap,user_attrs_mean_trtr_f1,user_attrs_mean_tstr_f1,user_attrs_mia_auc,user_attrs_nndr,user_attrs_nndr_norm,user_attrs_objective,user_attrs_privacy_risk,user_attrs_sdv_quality,user_attrs_utility,user_attrs_w_fidelity,user_attrs_w_privacy_risk,user_attrs_w_utility,state
0,0.2830105711077265,2026-08-14 16:59:31.060249,2026-08-14 17:14:49.701746,0 days 00:15:18.641497,vp,50,0.46653030122128325,9,100,50,0.950944689402134,2.086788195806648,0.0,0.9344939682388196,0.9180432470755052,0.9396481266399964,0.9396481266399964,0.0,0.704647917561185,0.9256171037385943,0.9256171037385943,0.2830105711077265,0.5746388276590142,,0.06035187336000358,0.4,0.2,0.4,COMPLETE
1,0.2969733295577577,2026-08-14 17:14:49.702138,2026-08-14 17:23:12.501289,0 days 00:08:22.799151,vp,150,0.11623364244752171,5,50,90,0.9646307212185474,1.8896882829101804,0.0,0.940734360963758,0.9168380007089685,0.9396481266399964,0.9396481266399964,0.0,0.5817947617003005,0.9119718666380513,0.9119718666380513,0.2969733295577577,0.5173058208587349,,0.06035187336000358,0.4,0.2,0.4,COMPLETE
2,0.29826428915943254,2026-08-14 17:23:12.501688,2026-08-14 17:26:12.963474,0 days 00:03:00.461786,flow,50,0.32163799964249457,4,200,60,0.953374681786946,1.9415747104103178,0.0,0.9405653983199176,0.9277561148528891,0.9396481266399964,0.9396481266399964,0.0,0.5736904250751396,0.9211070499163001,0.9211070499163001,0.29826428915943254,0.5105130975626797,,0.06035187336000358,0.4,0.2,0.4,COMPLETE
3,0.2695717660944309,2026-08-14 17:26:12.965503,2026-08-14 17:47:33.648980,0 days 00:21:20.683477,vp,75,0.16559149440361903,10,100,40,0.9442347174366738,2.314234371475748,0.0,0.9182003080270926,0.8921658986175116,0.9396481266399964,0.9396481266399964,0.0,0.7854229282954058,0.9448864394855492,0.9448864394855492,0.2695717660944309,0.6092455323020382,,0.06035187336000358,0.4,0.2,0.4,COMPLETE
4,0.28382023030277115,2026-08-14 17:47:33.650054,2026-08-14 18:19:36.827632,0 days 00:32:03.177578,vp,75,0.1057548601084279,10,100,60,0.9532863775532863,1.9873450934532675,0.0,0.9317300374118789,0.9101736972704716,0.9396481266399964,0.9396481266399964,0.0,0.6833404894804637,0.9220252490344082,0.9220252490344082,0.28382023030277115,0.5650626700299094,,0.06035187336000358,0.4,0.2,0.4,COMPLETE
5,0.28023608782746723,2026-08-14 18:19:36.828031,2026-08-14 18:36:10.785774,0 days 00:16:33.957743,vp,75,0.07901065932051939,9,100,50,0.9472711786638771,2.0622982002266244,0.0,0.9245749725293864,0.9018787663948955,0.9396481266399964,0.9396481266399964,0.0,0.6881172176899958,0.9179511873451799,0.9179511873451799,0.28023608782746723,0.568673252641444,,0.06035187336000358,0.4,0.2,0.4,COMPLETE
6,0.2898620970519077,2026-08-14 18:36:10.786375,2026-08-14 18:36:57.731414,0 days 00:00:46.945039,flow,50,0.05787997763336385,3,50,20,0.9529358644764586,1.9008943567259997,0.0,0.9342134125643549,0.915490960652251,0.9396481266399964,0.9396481266399964,0.0,0.6350901674538428,0.9257499904591434,0.9257499904591434,0.2898620970519077,0.5398200865891785,,0.06035187336000358,0.4,0.2,0.4,COMPLETE
7,0.2829726539069523,2026-08-14 18:36:57.733310,2026-08-14 18:47:11.436055,0 days 00:10:13.702745,vp,150,0.15587110015023148,8,200,40,0.958070034127042,2.13401939029958,0.0,0.9382338827139995,0.9183977313009571,0.9396481266399964,0.9396481266399964,0.0,0.7249355946758266,0.9338651824155606,0.9338651824155606,0.2829726539069523,0.5823082426132451,,0.06035187336000358,0.4,0.2,0.4,COMPLETE
8,0.29210181811866487,2026-08-14 18:47:11.436469,2026-08-14 18:55:04.633390,0 days 00:07:53.196921,vp,50,0.2847876440759921,7,50,60,0.9509277108540103,2.007355652599171,0.0,0.9372859043458283,0.9236440978376462,0.9396481266399964,0.9396481266399964,0.0,0.6247853155860885,0.925420643249016,0.925420643249016,0.29210181811866487,0.5347664648183394,,0.06035187336000358,0.4,0.2,0.4,COMPLETE
9,0.27796387169988135,2026-08-14 18:55:04.633804,2026-08-14 19:10:44.745865,0 days 00:15:40.112061,vp,150,0.17310604986467962,9,200,40,0.954532208893693,2.1708862439614385,0.0,0.9360041406042374,0.917476072314782,0.9396481266399964,0.9396481266399964,0.0,0.7631494203520826,0.9289401358232199,0.9289401358232199,0.27796387169988135,0.6028926694290753,,0.06035187336000358,0.4,0.2,0.4,COMPLETE
10,0.3137417613251965,2026-08-14 19:10:44.752266,2026-08-14 19:15:44.147995,0 days 00:04:59.395729,flow,100,0.4042358248277152,3,200,100,0.9631738384578739,2.090332895379981,0.0,0.9504986526567993,0.9378234668557249,0.9396481266399964,0.9396481266399964,0.0,0.4639866895663375,0.9300036645851512,0.9300036645851512,0.3137417613251965,0.4529922454076234,,0.06035187336000358,0.4,0.2,0.4,COMPLETE
11,0.3137417613251965,2026-08-14 19:15:44.153188,2026-08-14 19:20:46.732892,0 days 00:05:02.579704,flow,100,0.4556289546777483,3,200,100,0.9631738384578739,2.090332895379981,0.0,0.9504986526567993,0.9378234668557249,0.9396481266399964,0.9396481266399964,0.0,0.4639866895663375,0.9300036645851512,0.9300036645851512,0.3137417613251965,0.4529922454076234,,0.06035187336000358,0.4,0.2,0.4,COMPLETE
12,0.3137417613251965,2026-08-14 19:20:46.737576,2026-08-14 19:25:46.750226,0 days 00:05:00.012650,flow,100,0.4987134068448533,3,200,100,0.9631738384578739,2.090332895379981,0.0,0.9504986526567993,0.9378234668557249,0.9396481266399964,0.9396481266399964,0.0,0.4639866895663375,0.9300036645851512,0.9300036645851512,0.3137417613251965,0.4529922454076234,,0.06035187336000358,0.4,0.2,0.4,COMPLETE
13,0.31430107734265833,2026-08-14 19:25:46.753967,2026-08-14 19:33:05.002570,0 days 00:07:18.248603,flow,100,0.3079265035301516,5,200,90,0.9648882084653502,1.87772574135113,0.0,0.9524192903368934,0.9399503722084367,0.9396481266399964,0.9396481266399964,0.0,0.4582975525976814,0.9170394520611277,0.9170394520611277,0.31430107734265833,0.45403694068050243,,0.06035187336000358,0.4,0.2,0.4,COMPLETE
14,0.30960431625468726,2026-08-14 19:33:05.007071,2026-08-14 19:41:48.154069,0 days 00:08:43.146998,flow,100,0.2627999336913678,6,200,80,0.9615590530232428,1.8048274653784744,0.0,0.9492658788689415,0.9369727047146402,0.9396481266399964,0.9396481266399964,0.0,0.48996350364963503,0.9125594288012112,0.9125594288012112,0.30960431625468726,0.47121392318445415,,0.06035187336000358,0.4,0.2,0.4,COMPLETE
15,0.31219475999030755,2026-08-14 19:41:48.160492,2026-08-14 19:48:20.870293,0 days 00:06:32.709801,flow,100,0.3489155688307239,5,200,80,0.9653740190184464,1.8787718817382337,0.0,0.9526267471908964,0.9398794753633463,0.9396481266399964,0.9396481266399964,0.0,0.47885358522971233,0.9148111715486461,0.9148111715486461,0.31219475999030755,0.46498344115026236,,0.06035187336000358,0.4,0.2,0.4,COMPLETE
16,0.31219475999030755,2026-08-14 19:48:20.880507,2026-08-14 19:54:57.727513,0 days 00:06:36.847006,flow,100,0.22397416974947523,5,200,80,0.9653740190184464,1.8787718817382337,0.0,0.9526267471908964,0.9398794753633463,0.9396481266399964,0.9396481266399964,0.0,0.47885358522971233,0.9148111715486461,0.9148111715486461,0.31219475999030755,0.46498344115026236,,0.06035187336000358,0.4,0.2,0.4,COMPLETE
17,0.3134892545047979,2026-08-14 19:54:57.734353,2026-08-14 20:00:48.399287,0 days 00:05:50.664934,flow,100,0.2170180444943406,4,200,90,0.9654629605172848,1.9736542295310968,0.0,0.9524585274050443,0.9394540942928039,0.9396481266399964,0.9396481266399964,0.0,0.46999785315586085,0.9227479919060794,0.9227479919060794,0.3134892545047979,0.4581745290061066,,0.06035187336000358,0.4,0.2,0.4,COMPLETE
18,0.3079224573429053,2026-08-14 20:00:48.408560,2026-08-14 20:10:42.370388,0 days 00:09:53.961828,flow,100,0.3704232059049901,6,200,90,0.962671198001793,1.8088493083020198,0.0,0.9504600229640301,0.9382488479262673,0.9396481266399964,0.9396481266399964,0.0,0.509499785315586,0.9091279557475063,0.9091279557475063,0.3079224573429053,0.48201150593354114,,0.06035187336000358,0.4,0.2,0.4,COMPLETE
19,0.3174015046180153,2026-08-14 20:10:42.378879,2026-08-14 20:17:16.595659,0 days 00:06:34.216780,flow,100,0.3861397180825532,4,50,100,0.965107412155359,1.977008659345512,0.0,0.9527061342946239,0.9403048564338887,0.9396481266399964,0.9396481266399964,0.0,0.4325890940317733,0.923953515989027,0.923953515989027,0.3174015046180153,0.4391084922191786,,0.06035187336000358,0.4,0.2,0.4,COMPLETE
