number,value,datetime_start,datetime_complete,duration,params_diffusion_type,params_duplicate_K,params_eta,params_max_depth,params_n_estimators,params_n_t,user_attrs_corr_similarity,user_attrs_dcr,user_attrs_dcr_norm,user_attrs_fidelity,user_attrs_ks_similarity,user_attrs_mean_f1_gap,user_attrs_mean_trtr_f1,user_attrs_mean_tstr_f1,user_attrs_mia_auc,user_attrs_nndr,user_attrs_nndr_norm,user_attrs_objective,user_attrs_privacy_risk,user_attrs_sdv_quality,user_attrs_utility,user_attrs_w_fidelity,user_attrs_w_privacy_risk,user_attrs_w_utility,state
0,0.23048704832864308,2026-08-20 11:05:56.133488,2026-08-20 11:08:28.908098,0 days 00:02:32.774610,vp,50,0.46653030122128325,9,100,50,0.9585648800770915,1.1417521046050854,0.0,0.8919069180340484,0.8252489559910053,0.9411162314388121,0.9411162314388121,0.0,0.9965397923875432,0.8304125488217148,0.8304125488217148,0.23048704832864308,0.7491461315472572,,0.05888376856118793,0.4,0.2,0.4,COMPLETE
1,0.22983293755858128,2026-08-20 11:08:28.908474,2026-08-20 11:10:15.791086,0 days 00:01:46.882612,vp,150,0.11623364244752171,5,50,90,0.9511651625983334,1.0726622805321588,0.0,0.8882070592946695,0.8252489559910056,0.9411162314388121,0.9411162314388121,0.0,0.9878200692041523,0.8296435556108929,0.8296435556108929,0.22983293755858128,0.7450169679188083,,0.05888376856118793,0.4,0.2,0.4,COMPLETE
2,0.23251649050059137,2026-08-20 11:10:15.791479,2026-08-20 11:10:55.349911,0 days 00:00:39.558432,flow,50,0.32163799964249457,4,200,60,0.9598778365074058,1.1441144071464344,0.0,0.8920815459440337,0.8242852553806617,0.9411162314388121,0.9411162314388121,0.0,0.9821453287197233,0.8390816261745841,0.8390816261745841,0.23251649050059137,0.7393481765074863,,0.05888376856118793,0.4,0.2,0.4,COMPLETE
3,0.23111365023763822,2026-08-20 11:10:55.351135,2026-08-20 11:14:10.159668,0 days 00:03:14.808533,vp,75,0.16559149440361903,10,100,40,0.9499493214164346,1.1111040620187072,0.0,0.8903296237663605,0.8307099261162865,0.9411162314388121,0.9411162314388121,0.0,0.9882352941176471,0.8375303786397268,0.8375303786397268,0.23111365023763822,0.7428585334669056,,0.05888376856118793,0.4,0.2,0.4,COMPLETE
4,0.22554508130652712,2026-08-20 11:14:10.160074,2026-08-20 11:19:07.317431,0 days 00:04:57.157357,vp,75,0.1057548601084279,10,100,60,0.9513949706262448,1.1241086090227006,0.0,0.8835034602569065,0.8156119498875682,0.9411162314388121,0.9411162314388121,0.0,0.9887889273356402,0.7911513752142229,0.7911513752142229,0.22554508130652712,0.7570490511035532,,0.05888376856118793,0.4,0.2,0.4,COMPLETE
5,0.23206406944562036,2026-08-20 11:19:07.317838,2026-08-20 11:21:53.798965,0 days 00:02:46.481127,vp,75,0.07901065932051939,9,100,50,0.9543621739115831,1.1227349464054037,0.0,0.8907692655616379,0.8271763572116928,0.9411162314388121,0.9411162314388121,0.0,0.9916955017301038,0.8562067661583402,0.8562067661583402,0.23206406944562036,0.7389857210175499,,0.05888376856118793,0.4,0.2,0.4,COMPLETE
6,0.22943555110157365,2026-08-20 11:21:53.800854,2026-08-20 11:22:04.630040,0 days 00:00:10.829186,flow,50,0.05787997763336385,3,50,20,0.9574558286205819,1.178453967649983,0.0,0.8862126557172938,0.8149694828140057,0.9411162314388121,0.9411162314388121,0.0,0.9940484429065745,0.8466970946806396,0.8466970946806396,0.22943555110157365,0.7430150930490953,,0.05888376856118793,0.4,0.2,0.4,COMPLETE
7,0.22889963516820439,2026-08-20 11:22:04.630974,2026-08-20 11:23:47.977733,0 days 00:01:43.346759,vp,150,0.15587110015023148,8,200,40,0.9477484513240086,1.09391880814299,0.0,0.8876230210362414,0.8274975907484741,0.9411162314388121,0.9411162314388121,0.0,0.993356401384083,0.8272093244606832,0.8272093244606832,0.22889963516820439,0.7485154033538366,,0.05888376856118793,0.4,0.2,0.4,COMPLETE
8,0.2286407597943714,2026-08-20 11:23:47.978104,2026-08-20 11:25:16.995389,0 days 00:01:29.017285,vp,50,0.2847876440759921,7,50,60,0.9495713464030918,1.0460289180618043,0.0,0.885964600281533,0.8223578541599742,0.9411162314388121,0.9411162314388121,0.0,0.9793771626297578,0.810652142004314,0.810652142004314,0.2286407597943714,0.7464929387135848,,0.05888376856118793,0.4,0.2,0.4,COMPLETE
9,0.2289222241077325,2026-08-20 11:25:16.997428,2026-08-20 11:27:47.499334,0 days 00:02:30.501906,vp,150,0.17310604986467962,9,200,40,0.9541874353160533,1.068751288839136,0.0,0.8927699142529512,0.831352393189849,0.9411162314388121,0.9411162314388121,0.0,0.9926643598615917,0.7921197828039344,0.7921197828039344,0.2289222241077325,0.7586962450896155,,0.05888376856118793,0.4,0.2,0.4,COMPLETE
10,0.23789366831740238,2026-08-20 11:27:47.499711,2026-08-20 11:28:58.655108,0 days 00:01:11.155397,flow,100,0.4042358248277152,3,200,100,0.9631446808620453,1.2164159614767964,0.0,0.9049581419086968,0.8467716029553484,0.9411162314388121,0.9411162314388121,0.0,0.9893425605536332,0.8548526697468635,0.8548526697468635,0.23789366831740238,0.7382154793527576,,0.05888376856118793,0.4,0.2,0.4,COMPLETE
11,0.23789366831740238,2026-08-20 11:28:58.656945,2026-08-20 11:30:12.123763,0 days 00:01:13.466818,flow,100,0.4556289546777483,3,200,100,0.9631446808620453,1.2164159614767964,0.0,0.9049581419086968,0.8467716029553484,0.9411162314388121,0.9411162314388121,0.0,0.9893425605536332,0.8548526697468635,0.8548526697468635,0.23789366831740238,0.7382154793527576,,0.05888376856118793,0.4,0.2,0.4,COMPLETE
12,0.23789366831740238,2026-08-20 11:30:12.125927,2026-08-20 11:31:23.189471,0 days 00:01:11.063544,flow,100,0.4987134068448533,3,200,100,0.9631446808620453,1.2164159614767964,0.0,0.9049581419086968,0.8467716029553484,0.9411162314388121,0.9411162314388121,0.0,0.9893425605536332,0.8548526697468635,0.8548526697468635,0.23789366831740238,0.7382154793527576,,0.05888376856118793,0.4,0.2,0.4,COMPLETE
13,0.23504855894008167,2026-08-20 11:31:23.191178,2026-08-20 11:32:56.803040,0 days 00:01:33.611862,flow,100,0.3079265035301516,5,200,90,0.9636762499942172,1.081980806922574,0.0,0.9023328246437516,0.8409893992932862,0.9411162314388121,0.9411162314388121,0.0,0.9900346020761246,0.8260896977619714,0.8260896977619714,0.23504855894008167,0.7471903917094709,,0.05888376856118793,0.4,0.2,0.4,COMPLETE
14,0.23576345208151503,2026-08-20 11:32:56.804335,2026-08-20 11:34:20.901002,0 days 00:01:24.096667,flow,100,0.3781653437033125,4,200,100,0.9643409685937204,1.159734132483455,0.0,0.9026651839435033,0.8409893992932861,0.9411162314388121,0.9411162314388121,0.0,0.9916955017301038,0.8385570208774816,0.8385570208774816,0.23576345208151503,0.7442806446018073,,0.05888376856118793,0.4,0.2,0.4,COMPLETE
15,0.2357744641408191,2026-08-20 11:34:20.902779,2026-08-20 11:35:43.949833,0 days 00:01:23.047054,flow,100,0.2248747891406182,5,200,80,0.968492931748132,1.0884063325430473,0.0,0.9053836325942715,0.842274333440411,0.9411162314388121,0.9411162314388121,0.0,0.9908650519031141,0.8192334811491125,0.8192334811491125,0.2357744641408191,0.7496624816068234,,0.05888376856118793,0.4,0.2,0.4,COMPLETE
16,0.23533771366667905,2026-08-20 11:35:43.951300,2026-08-20 11:36:40.142994,0 days 00:00:56.191694,flow,100,0.39498956240951644,3,200,80,0.963120565024418,1.2188340342413546,0.0,0.9001275809381646,0.8371345968519113,0.9411162314388121,0.9411162314388121,0.0,0.9991695501730105,0.8608354814039848,0.8608354814039848,0.23533771366667905,0.7413341306653098,,0.05888376856118793,0.4,0.2,0.4,COMPLETE
17,0.23557952520588576,2026-08-20 11:36:40.144364,2026-08-20 11:38:37.985534,0 days 00:01:57.841170,flow,100,0.23407457724271577,6,200,90,0.9629863742514257,1.0589338447198058,0.0,0.9047183718349965,0.8464503694185672,0.9411162314388121,0.9411162314388121,0.0,0.9829757785467128,0.8072707817013876,0.8072707817013876,0.23557952520588576,0.7493066547629401,,0.05888376856118793,0.4,0.2,0.4,COMPLETE
18,0.23700254562658374,2026-08-20 11:38:37.987938,2026-08-20 11:39:51.305550,0 days 00:01:13.317612,flow,100,0.381456595692922,4,200,80,0.963778694275258,1.1553535457582578,0.0,0.9036689809313969,0.843559267587536,0.9411162314388121,0.9411162314388121,0.0,0.9915570934256056,0.852285919535173,0.852285919535173,0.23700254562658374,0.7400927708522509,,0.05888376856118793,0.4,0.2,0.4,COMPLETE
19,0.23789366831740238,2026-08-20 11:39:51.307107,2026-08-20 11:41:10.893675,0 days 00:01:19.586568,flow,100,0.23973203417094388,3,50,100,0.9631446808620453,1.2164159614767964,0.0,0.9049581419086968,0.8467716029553484,0.9411162314388121,0.9411162314388121,0.0,0.9893425605536332,0.8548526697468635,0.8548526697468635,0.23789366831740238,0.7382154793527576,,0.05888376856118793,0.4,0.2,0.4,COMPLETE
