number,value,datetime_start,datetime_complete,duration,params_default_distribution,params_enforce_min_max_values,user_attrs_corr_similarity,user_attrs_dcr,user_attrs_dcr_norm,user_attrs_fidelity,user_attrs_ks_similarity,user_attrs_mean_f1_gap,user_attrs_mean_trtr_f1,user_attrs_mean_tstr_f1,user_attrs_mia_auc,user_attrs_nndr,user_attrs_nndr_norm,user_attrs_objective,user_attrs_privacy_risk,user_attrs_sdv_quality,user_attrs_utility,user_attrs_w_fidelity,user_attrs_w_privacy_risk,user_attrs_w_utility,state
0,0.48771603063565094,2026-08-26 13:04:59.993365,2026-08-26 13:05:03.158455,0 days 00:00:03.165090,truncnorm,True,0.9434484299253413,3.9139234634338465,0.0,0.9619173967808525,0.9803863636363638,0.40949460218368094,0.6007944326922773,0.19129983050859634,0.9188194444444445,0.9771476206871126,0.9771476206871126,0.48771603063565094,0.6662654360160885,,0.590505397816319,0.4,0.2,0.4,COMPLETE
1,0.46518622139234245,2026-08-26 13:05:03.159035,2026-08-26 13:05:05.844462,0 days 00:00:02.685427,uniform,True,0.9435930233508563,5.778089859256664,0.0,0.9388419662208827,0.9340909090909092,0.42544122673874535,0.6007944326922773,0.1753532059535319,0.9862673611111111,0.9742110285099765,0.9742110285099765,0.46518622139234245,0.7008703720025626,,0.5745587732612547,0.4,0.2,0.4,COMPLETE
2,0.43712608104583206,2026-08-26 13:05:05.845133,2026-08-26 13:05:10.959473,0 days 00:00:05.114340,gamma,False,0.9420417906872047,5.480854607549581,0.0,0.9422027135254206,0.9423636363636365,0.49516688403025527,0.6007944326922773,0.10562754866202194,0.9997743055555556,0.9714863300553582,0.9714863300553582,0.43712608104583206,0.7084412537611704,,0.5048331159697448,0.4,0.2,0.4,COMPLETE
3,0.46518622139234245,2026-08-26 13:05:10.959857,2026-08-26 13:05:13.583131,0 days 00:00:02.623274,uniform,False,0.9435930233508563,5.778089859256664,0.0,0.9388419662208827,0.9340909090909092,0.42544122673874535,0.6007944326922773,0.1753532059535319,0.9862673611111111,0.9742110285099765,0.9742110285099765,0.46518622139234245,0.7008703720025626,,0.5745587732612547,0.4,0.2,0.4,COMPLETE
4,0.4769915355694234,2026-08-26 13:05:13.583479,2026-08-26 13:05:16.239892,0 days 00:00:02.656413,norm,False,0.9437256771967637,5.3786316757592205,0.0,0.9520219295074728,0.9603181818181817,0.42037090278908057,0.6007944326922773,0.18042352990319666,0.9389583333333333,0.9704493035899984,0.9704493035899984,0.4769915355694234,0.6783443755896672,,0.5796290972109195,0.4,0.2,0.4,COMPLETE
5,0.47633461937218846,2026-08-26 13:05:16.240430,2026-08-26 13:05:21.740044,0 days 00:00:05.499614,beta,False,0.9452008119986164,4.031741740052513,0.0,0.9622594969083991,0.9793181818181819,0.4268059821317058,0.6007944326922773,0.17398845056057147,0.9623611111111111,0.9731554095437034,0.9731554095437034,0.47633461937218846,0.6892339326924446,,0.5731940178682942,0.4,0.2,0.4,COMPLETE
6,0.48771603063565094,2026-08-26 13:05:21.740680,2026-08-26 13:05:24.691889,0 days 00:00:02.951209,truncnorm,False,0.9434484299253413,3.9139234634338465,0.0,0.9619173967808525,0.9803863636363638,0.40949460218368094,0.6007944326922773,0.19129983050859634,0.9188194444444445,0.9771476206871126,0.9771476206871126,0.48771603063565094,0.6662654360160885,,0.590505397816319,0.4,0.2,0.4,COMPLETE
7,0.48771603063565094,2026-08-26 13:05:24.692620,2026-08-26 13:05:27.803995,0 days 00:00:03.111375,truncnorm,False,0.9434484299253413,3.9139234634338465,0.0,0.9619173967808525,0.9803863636363638,0.40949460218368094,0.6007944326922773,0.19129983050859634,0.9188194444444445,0.9771476206871126,0.9771476206871126,0.48771603063565094,0.6662654360160885,,0.590505397816319,0.4,0.2,0.4,COMPLETE
8,0.46518622139234245,2026-08-26 13:05:27.804644,2026-08-26 13:05:30.476307,0 days 00:00:02.671663,uniform,False,0.9435930233508563,5.778089859256664,0.0,0.9388419662208827,0.9340909090909092,0.42544122673874535,0.6007944326922773,0.1753532059535319,0.9862673611111111,0.9742110285099765,0.9742110285099765,0.46518622139234245,0.7008703720025626,,0.5745587732612547,0.4,0.2,0.4,COMPLETE
9,0.46518622139234245,2026-08-26 13:05:30.476961,2026-08-26 13:05:33.196208,0 days 00:00:02.719247,uniform,False,0.9435930233508563,5.778089859256664,0.0,0.9388419662208827,0.9340909090909092,0.42544122673874535,0.6007944326922773,0.1753532059535319,0.9862673611111111,0.9742110285099765,0.9742110285099765,0.46518622139234245,0.7008703720025626,,0.5745587732612547,0.4,0.2,0.4,COMPLETE
10,0.48771603063565094,2026-08-26 13:05:33.196808,2026-08-26 13:05:36.252758,0 days 00:00:03.055950,truncnorm,True,0.9434484299253413,3.9139234634338465,0.0,0.9619173967808525,0.9803863636363638,0.40949460218368094,0.6007944326922773,0.19129983050859634,0.9188194444444445,0.9771476206871126,0.9771476206871126,0.48771603063565094,0.6662654360160885,,0.590505397816319,0.4,0.2,0.4,COMPLETE
11,0.48771603063565094,2026-08-26 13:05:36.253355,2026-08-26 13:05:39.245155,0 days 00:00:02.991800,truncnorm,True,0.9434484299253413,3.9139234634338465,0.0,0.9619173967808525,0.9803863636363638,0.40949460218368094,0.6007944326922773,0.19129983050859634,0.9188194444444445,0.9771476206871126,0.9771476206871126,0.48771603063565094,0.6662654360160885,,0.590505397816319,0.4,0.2,0.4,COMPLETE
12,0.48771603063565094,2026-08-26 13:05:39.245564,2026-08-26 13:05:42.299280,0 days 00:00:03.053716,truncnorm,True,0.9434484299253413,3.9139234634338465,0.0,0.9619173967808525,0.9803863636363638,0.40949460218368094,0.6007944326922773,0.19129983050859634,0.9188194444444445,0.9771476206871126,0.9771476206871126,0.48771603063565094,0.6662654360160885,,0.590505397816319,0.4,0.2,0.4,COMPLETE
13,0.48771603063565094,2026-08-26 13:05:42.299810,2026-08-26 13:05:45.407511,0 days 00:00:03.107701,truncnorm,True,0.9434484299253413,3.9139234634338465,0.0,0.9619173967808525,0.9803863636363638,0.40949460218368094,0.6007944326922773,0.19129983050859634,0.9188194444444445,0.9771476206871126,0.9771476206871126,0.48771603063565094,0.6662654360160885,,0.590505397816319,0.4,0.2,0.4,COMPLETE
14,0.4742625099990258,2026-08-26 13:05:45.408131,2026-08-26 13:05:50.954435,0 days 00:00:05.546304,beta,True,0.9452102507536181,4.0057485473177294,0.0,0.9622642162859,0.9793181818181819,0.4322303193759405,0.6007944326922773,0.1685641133163368,0.9611805555555556,0.9727834465099581,0.9727834465099581,0.4742625099990258,0.6887552438247904,,0.5677696806240595,0.4,0.2,0.4,COMPLETE
15,0.4764571895219486,2026-08-26 13:05:50.955036,2026-08-26 13:05:53.641389,0 days 00:00:02.686353,norm,True,0.9435641934864356,5.262556843234977,0.0,0.952179824015945,0.9607954545454545,0.4254120447302004,0.6007944326922773,0.17538238796207692,0.9247048611111112,0.9703427319793632,0.9703427319793632,0.4764571895219486,0.6712496109617466,,0.5745879552697997,0.4,0.2,0.4,COMPLETE
16,0.43712608104583206,2026-08-26 13:05:53.641891,2026-08-26 13:05:58.503271,0 days 00:00:04.861380,gamma,False,0.9420417906872047,5.480854607549581,0.0,0.9422027135254206,0.9423636363636365,0.49516688403025527,0.6007944326922773,0.10562754866202194,0.9997743055555556,0.9714863300553582,0.9714863300553582,0.43712608104583206,0.7084412537611704,,0.5048331159697448,0.4,0.2,0.4,COMPLETE
17,0.48771603063565094,2026-08-26 13:05:58.503846,2026-08-26 13:06:01.473648,0 days 00:00:02.969802,truncnorm,True,0.9434484299253413,3.9139234634338465,0.0,0.9619173967808525,0.9803863636363638,0.40949460218368094,0.6007944326922773,0.19129983050859634,0.9188194444444445,0.9771476206871126,0.9771476206871126,0.48771603063565094,0.6662654360160885,,0.590505397816319,0.4,0.2,0.4,COMPLETE
18,0.48771603063565094,2026-08-26 13:06:01.473982,2026-08-26 13:06:04.469653,0 days 00:00:02.995671,truncnorm,True,0.9434484299253413,3.9139234634338465,0.0,0.9619173967808525,0.9803863636363638,0.40949460218368094,0.6007944326922773,0.19129983050859634,0.9188194444444445,0.9771476206871126,0.9771476206871126,0.48771603063565094,0.6662654360160885,,0.590505397816319,0.4,0.2,0.4,COMPLETE
19,0.48771603063565094,2026-08-26 13:06:04.470173,2026-08-26 13:06:07.564875,0 days 00:00:03.094702,truncnorm,False,0.9434484299253413,3.9139234634338465,0.0,0.9619173967808525,0.9803863636363638,0.40949460218368094,0.6007944326922773,0.19129983050859634,0.9188194444444445,0.9771476206871126,0.9771476206871126,0.48771603063565094,0.6662654360160885,,0.590505397816319,0.4,0.2,0.4,COMPLETE
