number,value,datetime_start,datetime_complete,duration,params_default_distribution,params_enforce_min_max_values,user_attrs_corr_similarity,user_attrs_dcr,user_attrs_dcr_norm,user_attrs_fidelity,user_attrs_ks_similarity,user_attrs_mean_f1_gap,user_attrs_mean_trtr_f1,user_attrs_mean_tstr_f1,user_attrs_mia_auc,user_attrs_nndr,user_attrs_nndr_norm,user_attrs_objective,user_attrs_privacy_risk,user_attrs_sdv_quality,user_attrs_utility,user_attrs_w_fidelity,user_attrs_w_privacy_risk,user_attrs_w_utility,state
0,0.45132737288045366,2026-08-24 11:55:34.262635,2026-08-24 11:55:35.614920,0 days 00:00:01.352285,truncnorm,True,0.9456177790306418,2.499704545484165,0.0,0.812451746658178,0.6792857142857143,0.3289507849769078,0.8377876505675849,0.5088368655906771,0.999826388888889,0.965160451613908,0.965160451613908,0.45132737288045366,0.7103650589602721,,0.6710492150230922,0.4,0.2,0.4,COMPLETE
1,0.3180518570527839,2026-08-24 11:55:35.615166,2026-08-24 11:55:36.606564,0 days 00:00:00.991398,uniform,True,0.9390408169733928,5.046503355802669,0.0,0.723716837058125,0.5083928571428571,0.5719845356131942,0.8377876505675849,0.2658031149543907,1.0,0.9559822745801925,0.9559822745801925,0.3180518570527839,0.7132053176259423,,0.4280154643868058,0.4,0.2,0.4,COMPLETE
2,0.5611326194470851,2026-08-24 11:55:36.606833,2026-08-24 11:55:38.091969,0 days 00:00:01.485136,gamma,False,0.9462169300869746,2.4025920865129464,0.0,0.8399834650434873,0.73375,0.08116587877241095,0.8377876505675849,0.7566217717951739,0.99890625,0.9582701656442439,0.9582701656442439,0.5611326194470851,0.7119720753067269,,0.918834121227589,0.4,0.2,0.4,COMPLETE
3,0.3180518570527839,2026-08-24 11:55:38.092292,2026-08-24 11:55:38.928814,0 days 00:00:00.836522,uniform,False,0.9390408169733928,5.046503355802669,0.0,0.723716837058125,0.5083928571428571,0.5719845356131942,0.8377876505675849,0.2658031149543907,1.0,0.9559822745801925,0.9559822745801925,0.3180518570527839,0.7132053176259423,,0.4280154643868058,0.4,0.2,0.4,COMPLETE
4,0.5599278301548308,2026-08-24 11:55:38.929042,2026-08-24 11:55:39.763304,0 days 00:00:00.834262,norm,False,0.9577433323967223,2.4799656439457354,0.0,0.8682466661983611,0.7787499999999999,0.11348495476952192,0.8377876505675849,0.7243026957980631,1.0,0.9670524263882513,0.9670524263882513,0.5599278301548308,0.7098842720835246,,0.8865150452304781,0.4,0.2,0.4,COMPLETE
5,0.4013836671442892,2026-08-24 11:55:39.763502,2026-08-24 11:55:41.075020,0 days 00:00:01.311518,beta,False,0.9513461877030945,3.6018151160427174,0.0,0.8179052367086901,0.6844642857142856,0.46032577136151964,0.8377876505675849,0.3774618792060653,0.9999652777777778,0.9724734797199791,0.9724734797199791,0.4013836671442892,0.7082405949728952,,0.5396742286384804,0.4,0.2,0.4,COMPLETE
6,0.45132737288045366,2026-08-24 11:55:41.075217,2026-08-24 11:55:41.921740,0 days 00:00:00.846523,truncnorm,False,0.9456177790306418,2.499704545484165,0.0,0.812451746658178,0.6792857142857143,0.3289507849769078,0.8377876505675849,0.5088368655906771,0.999826388888889,0.965160451613908,0.965160451613908,0.45132737288045366,0.7103650589602721,,0.6710492150230922,0.4,0.2,0.4,COMPLETE
7,0.45132737288045366,2026-08-24 11:55:41.922027,2026-08-24 11:55:42.773173,0 days 00:00:00.851146,truncnorm,False,0.9456177790306418,2.499704545484165,0.0,0.812451746658178,0.6792857142857143,0.3289507849769078,0.8377876505675849,0.5088368655906771,0.999826388888889,0.965160451613908,0.965160451613908,0.45132737288045366,0.7103650589602721,,0.6710492150230922,0.4,0.2,0.4,COMPLETE
8,0.3180518570527839,2026-08-24 11:55:42.773562,2026-08-24 11:55:43.632206,0 days 00:00:00.858644,uniform,False,0.9390408169733928,5.046503355802669,0.0,0.723716837058125,0.5083928571428571,0.5719845356131942,0.8377876505675849,0.2658031149543907,1.0,0.9559822745801925,0.9559822745801925,0.3180518570527839,0.7132053176259423,,0.4280154643868058,0.4,0.2,0.4,COMPLETE
9,0.3180518570527839,2026-08-24 11:55:43.632413,2026-08-24 11:55:44.409001,0 days 00:00:00.776588,uniform,False,0.9390408169733928,5.046503355802669,0.0,0.723716837058125,0.5083928571428571,0.5719845356131942,0.8377876505675849,0.2658031149543907,1.0,0.9559822745801925,0.9559822745801925,0.3180518570527839,0.7132053176259423,,0.4280154643868058,0.4,0.2,0.4,COMPLETE
10,0.5640263055661681,2026-08-24 11:55:44.409222,2026-08-24 11:55:45.690942,0 days 00:00:01.281720,gamma,True,0.9489679187901477,2.3899660211522207,0.0,0.8413589593950739,0.73375,0.07509249807361211,0.8377876505675849,0.7626951524939729,0.9989583333333334,0.9569259061819442,0.9569259061819442,0.5640263055661681,0.7124013948120835,,0.9249075019263879,0.4,0.2,0.4,COMPLETE
11,0.5640263055661681,2026-08-24 11:55:45.691199,2026-08-24 11:55:46.879347,0 days 00:00:01.188148,gamma,True,0.9489679187901477,2.3899660211522207,0.0,0.8413589593950739,0.73375,0.07509249807361211,0.8377876505675849,0.7626951524939729,0.9989583333333334,0.9569259061819442,0.9569259061819442,0.5640263055661681,0.7124013948120835,,0.9249075019263879,0.4,0.2,0.4,COMPLETE
12,0.5640263055661681,2026-08-24 11:55:46.879615,2026-08-24 11:55:48.185647,0 days 00:00:01.306032,gamma,True,0.9489679187901477,2.3899660211522207,0.0,0.8413589593950739,0.73375,0.07509249807361211,0.8377876505675849,0.7626951524939729,0.9989583333333334,0.9569259061819442,0.9569259061819442,0.5640263055661681,0.7124013948120835,,0.9249075019263879,0.4,0.2,0.4,COMPLETE
13,0.5640263055661681,2026-08-24 11:55:48.186031,2026-08-24 11:55:49.653268,0 days 00:00:01.467237,gamma,True,0.9489679187901477,2.3899660211522207,0.0,0.8413589593950739,0.73375,0.07509249807361211,0.8377876505675849,0.7626951524939729,0.9989583333333334,0.9569259061819442,0.9569259061819442,0.5640263055661681,0.7124013948120835,,0.9249075019263879,0.4,0.2,0.4,COMPLETE
14,0.5640263055661681,2026-08-24 11:55:49.653639,2026-08-24 11:55:51.083905,0 days 00:00:01.430266,gamma,True,0.9489679187901477,2.3899660211522207,0.0,0.8413589593950739,0.73375,0.07509249807361211,0.8377876505675849,0.7626951524939729,0.9989583333333334,0.9569259061819442,0.9569259061819442,0.5640263055661681,0.7124013948120835,,0.9249075019263879,0.4,0.2,0.4,COMPLETE
15,0.5640263055661681,2026-08-24 11:55:51.084242,2026-08-24 11:55:52.443887,0 days 00:00:01.359645,gamma,True,0.9489679187901477,2.3899660211522207,0.0,0.8413589593950739,0.73375,0.07509249807361211,0.8377876505675849,0.7626951524939729,0.9989583333333334,0.9569259061819442,0.9569259061819442,0.5640263055661681,0.7124013948120835,,0.9249075019263879,0.4,0.2,0.4,COMPLETE
16,0.4016129951898801,2026-08-24 11:55:52.444077,2026-08-24 11:55:53.892051,0 days 00:00:01.447974,beta,True,0.9510694357947366,3.6018151160427174,0.0,0.8177668607545111,0.6844642857142856,0.45964996138338404,0.8377876505675849,0.3781376891842008,0.9999652777777778,0.9727127203201158,0.9727127203201158,0.4016129951898801,0.7081688227928542,,0.540350038616616,0.4,0.2,0.4,COMPLETE
17,0.5588129755691447,2026-08-24 11:55:53.892291,2026-08-24 11:55:54.946413,0 days 00:00:01.054122,norm,True,0.9608801890103491,2.325254696274447,0.0,0.8698150945051746,0.7787499999999999,0.12704083818142822,0.8377876505675849,0.7107468123861568,0.9608159722222223,0.9630811710311393,0.9630811710311393,0.5588129755691447,0.6914836348017693,,0.8729591618185718,0.4,0.2,0.4,COMPLETE
18,0.5640263055661681,2026-08-24 11:55:54.946966,2026-08-24 11:55:56.253066,0 days 00:00:01.306100,gamma,True,0.9489679187901477,2.3899660211522207,0.0,0.8413589593950739,0.73375,0.07509249807361211,0.8377876505675849,0.7626951524939729,0.9989583333333334,0.9569259061819442,0.9569259061819442,0.5640263055661681,0.7124013948120835,,0.9249075019263879,0.4,0.2,0.4,COMPLETE
19,0.5640263055661681,2026-08-24 11:55:56.253285,2026-08-24 11:55:57.436430,0 days 00:00:01.183145,gamma,True,0.9489679187901477,2.3899660211522207,0.0,0.8413589593950739,0.73375,0.07509249807361211,0.8377876505675849,0.7626951524939729,0.9989583333333334,0.9569259061819442,0.9569259061819442,0.5640263055661681,0.7124013948120835,,0.9249075019263879,0.4,0.2,0.4,COMPLETE
