number,value,datetime_start,datetime_complete,duration,params_default_distribution,params_enforce_min_max_values,user_attrs_corr_similarity,user_attrs_dcr,user_attrs_dcr_norm,user_attrs_fidelity,user_attrs_ks_similarity,user_attrs_mean_f1_gap,user_attrs_mean_trtr_f1,user_attrs_mean_tstr_f1,user_attrs_mia_auc,user_attrs_nndr,user_attrs_nndr_norm,user_attrs_objective,user_attrs_privacy_risk,user_attrs_sdv_quality,user_attrs_utility,user_attrs_w_fidelity,user_attrs_w_privacy_risk,user_attrs_w_utility,state
0,0.5694286207323577,2026-09-04 14:50:14.686794,2026-09-04 14:50:15.667933,0 days 00:00:00.981139,truncnorm,True,0.9646746657490466,1.5040618293884898,0.0,0.9273373328745232,0.8899999999999999,0.1604049343110594,0.7738226558300467,0.6134177215189873,0.9387500000000001,0.9421776884495361,0.9421776884495361,0.5694286207323577,0.6867216934651392,,0.8395950656889406,0.4,0.2,0.4,COMPLETE
1,0.39331705600742567,2026-09-04 14:50:15.668580,2026-09-04 14:50:16.616789,0 days 00:00:00.948209,uniform,True,0.9317062822902613,4.276343363200461,0.0,0.802216777508767,0.6727272727272727,0.463525249788542,0.7738226558300467,0.31029740604150474,0.994357638888889,0.9546034801370771,0.9546034801370771,0.39331705600742567,0.7107977754033215,,0.536474750211458,0.4,0.2,0.4,COMPLETE
2,0.4941253728281374,2026-09-04 14:50:16.617116,2026-09-04 14:50:17.814212,0 days 00:00:01.197096,gamma,False,0.9332794073010967,3.927184945576127,0.0,0.8866965218323666,0.8401136363636365,0.2949212119146945,0.7738226558300467,0.4789014439153522,1.0,0.956920814351142,0.956920814351142,0.4941253728281374,0.7129237556946575,,0.7050787880853056,0.4,0.2,0.4,COMPLETE
3,0.39331705600742567,2026-09-04 14:50:17.814739,2026-09-04 14:50:18.767251,0 days 00:00:00.952512,uniform,False,0.9317062822902613,4.276343363200461,0.0,0.802216777508767,0.6727272727272727,0.463525249788542,0.7738226558300467,0.31029740604150474,0.994357638888889,0.9546034801370771,0.9546034801370771,0.39331705600742567,0.7107977754033215,,0.536474750211458,0.4,0.2,0.4,COMPLETE
4,0.583058730811044,2026-09-04 14:50:18.767575,2026-09-04 14:50:19.622101,0 days 00:00:00.854526,norm,False,0.9751063002189195,1.6061269429772422,0.0,0.9315304228367325,0.8879545454545453,0.12592194445742444,0.7738226558300467,0.6479007113726223,0.9606597222222222,0.9480218613590499,0.9480218613590499,0.583058730811044,0.6959233027033962,,0.8740780555425756,0.4,0.2,0.4,COMPLETE
5,0.6299365234407833,2026-09-04 14:50:19.622312,2026-09-04 14:50:21.078434,0 days 00:00:01.456122,beta,False,0.9563720362165944,1.6634093046132183,0.0,0.9364814726537517,0.916590909090909,0.024973449480840387,0.7738226558300467,0.7488492063492064,0.9111458333333333,0.9407982917492013,0.9407982917492013,0.6299365234407833,0.6733334291419063,,0.9750265505191597,0.4,0.2,0.4,COMPLETE
6,0.5694286207323577,2026-09-04 14:50:21.078812,2026-09-04 14:50:22.086101,0 days 00:00:01.007289,truncnorm,False,0.9646746657490466,1.5040618293884898,0.0,0.9273373328745232,0.8899999999999999,0.1604049343110594,0.7738226558300467,0.6134177215189873,0.9387500000000001,0.9421776884495361,0.9421776884495361,0.5694286207323577,0.6867216934651392,,0.8395950656889406,0.4,0.2,0.4,COMPLETE
7,0.5694286207323577,2026-09-04 14:50:22.086309,2026-09-04 14:50:23.041095,0 days 00:00:00.954786,truncnorm,False,0.9646746657490466,1.5040618293884898,0.0,0.9273373328745232,0.8899999999999999,0.1604049343110594,0.7738226558300467,0.6134177215189873,0.9387500000000001,0.9421776884495361,0.9421776884495361,0.5694286207323577,0.6867216934651392,,0.8395950656889406,0.4,0.2,0.4,COMPLETE
8,0.39331705600742567,2026-09-04 14:50:23.041404,2026-09-04 14:50:23.947817,0 days 00:00:00.906413,uniform,False,0.9317062822902613,4.276343363200461,0.0,0.802216777508767,0.6727272727272727,0.463525249788542,0.7738226558300467,0.31029740604150474,0.994357638888889,0.9546034801370771,0.9546034801370771,0.39331705600742567,0.7107977754033215,,0.536474750211458,0.4,0.2,0.4,COMPLETE
9,0.39331705600742567,2026-09-04 14:50:23.948064,2026-09-04 14:50:24.837359,0 days 00:00:00.889295,uniform,False,0.9317062822902613,4.276343363200461,0.0,0.802216777508767,0.6727272727272727,0.463525249788542,0.7738226558300467,0.31029740604150474,0.994357638888889,0.9546034801370771,0.9546034801370771,0.39331705600742567,0.7107977754033215,,0.536474750211458,0.4,0.2,0.4,COMPLETE
10,0.6292332585345165,2026-09-04 14:50:24.837811,2026-09-04 14:50:26.347290,0 days 00:00:01.509479,beta,True,0.9565515501861622,1.6634093046132183,0.0,0.9365712296385356,0.916590909090909,0.027049151556542455,0.7738226558300467,0.7467735042735043,0.9104166666666667,0.9411015661397643,0.9411015661397643,0.6292332585345165,0.6728778634914041,,0.9729508484434576,0.4,0.2,0.4,COMPLETE
11,0.6292332585345165,2026-09-04 14:50:26.347569,2026-09-04 14:50:27.893432,0 days 00:00:01.545863,beta,True,0.9565515501861622,1.6634093046132183,0.0,0.9365712296385356,0.916590909090909,0.027049151556542455,0.7738226558300467,0.7467735042735043,0.9104166666666667,0.9411015661397643,0.9411015661397643,0.6292332585345165,0.6728778634914041,,0.9729508484434576,0.4,0.2,0.4,COMPLETE
12,0.6292332585345165,2026-09-04 14:50:27.893906,2026-09-04 14:50:29.393887,0 days 00:00:01.499981,beta,True,0.9565515501861622,1.6634093046132183,0.0,0.9365712296385356,0.916590909090909,0.027049151556542455,0.7738226558300467,0.7467735042735043,0.9104166666666667,0.9411015661397643,0.9411015661397643,0.6292332585345165,0.6728778634914041,,0.9729508484434576,0.4,0.2,0.4,COMPLETE
13,0.6292332585345165,2026-09-04 14:50:29.394283,2026-09-04 14:50:30.870041,0 days 00:00:01.475758,beta,True,0.9565515501861622,1.6634093046132183,0.0,0.9365712296385356,0.916590909090909,0.027049151556542455,0.7738226558300467,0.7467735042735043,0.9104166666666667,0.9411015661397643,0.9411015661397643,0.6292332585345165,0.6728778634914041,,0.9729508484434576,0.4,0.2,0.4,COMPLETE
14,0.6292332585345165,2026-09-04 14:50:30.870337,2026-09-04 14:50:32.371657,0 days 00:00:01.501320,beta,True,0.9565515501861622,1.6634093046132183,0.0,0.9365712296385356,0.916590909090909,0.027049151556542455,0.7738226558300467,0.7467735042735043,0.9104166666666667,0.9411015661397643,0.9411015661397643,0.6292332585345165,0.6728778634914041,,0.9729508484434576,0.4,0.2,0.4,COMPLETE
15,0.6292332585345165,2026-09-04 14:50:32.372068,2026-09-04 14:50:33.849133,0 days 00:00:01.477065,beta,True,0.9565515501861622,1.6634093046132183,0.0,0.9365712296385356,0.916590909090909,0.027049151556542455,0.7738226558300467,0.7467735042735043,0.9104166666666667,0.9411015661397643,0.9411015661397643,0.6292332585345165,0.6728778634914041,,0.9729508484434576,0.4,0.2,0.4,COMPLETE
16,0.5817620456123579,2026-09-04 14:50:33.849503,2026-09-04 14:50:34.797624,0 days 00:00:00.948121,norm,True,0.9723798192948983,1.5204925617061043,0.0,0.93022400055654,0.8880681818181817,0.12847006889547188,0.7738226558300467,0.6453525869345748,0.9540798611111111,0.9411409843173629,0.9411409843173629,0.5817620456123579,0.6946976352603467,,0.8715299311045281,0.4,0.2,0.4,COMPLETE
17,0.4941253728281374,2026-09-04 14:50:34.797968,2026-09-04 14:50:35.953798,0 days 00:00:01.155830,gamma,False,0.9332794073010967,3.927184945576127,0.0,0.8866965218323666,0.8401136363636365,0.2949212119146945,0.7738226558300467,0.4789014439153522,1.0,0.956920814351142,0.956920814351142,0.4941253728281374,0.7129237556946575,,0.7050787880853056,0.4,0.2,0.4,COMPLETE
18,0.6292332585345165,2026-09-04 14:50:35.954028,2026-09-04 14:50:37.456265,0 days 00:00:01.502237,beta,True,0.9565515501861622,1.6634093046132183,0.0,0.9365712296385356,0.916590909090909,0.027049151556542455,0.7738226558300467,0.7467735042735043,0.9104166666666667,0.9411015661397643,0.9411015661397643,0.6292332585345165,0.6728778634914041,,0.9729508484434576,0.4,0.2,0.4,COMPLETE
19,0.6299365234407833,2026-09-04 14:50:37.456813,2026-09-04 14:50:39.272306,0 days 00:00:01.815493,beta,False,0.9563720362165944,1.6634093046132183,0.0,0.9364814726537517,0.916590909090909,0.024973449480840387,0.7738226558300467,0.7488492063492064,0.9111458333333333,0.9407982917492013,0.9407982917492013,0.6299365234407833,0.6733334291419063,,0.9750265505191597,0.4,0.2,0.4,COMPLETE
