number,value,datetime_start,datetime_complete,duration,params_default_distribution,params_enforce_min_max_values,user_attrs_corr_similarity,user_attrs_dcr,user_attrs_dcr_norm,user_attrs_fidelity,user_attrs_ks_similarity,user_attrs_mean_f1_gap,user_attrs_mean_trtr_f1,user_attrs_mean_tstr_f1,user_attrs_mia_auc,user_attrs_nndr,user_attrs_nndr_norm,user_attrs_objective,user_attrs_privacy_risk,user_attrs_sdv_quality,user_attrs_utility,user_attrs_w_fidelity,user_attrs_w_privacy_risk,user_attrs_w_utility,state
0,0.17589534515792088,2026-09-08 14:02:26.094197,2026-09-08 14:02:26.771539,0 days 00:00:00.677342,truncnorm,True,0.8923641947928226,1.8616515688647621,0.0,0.792624405088719,0.6928846153846154,2.965892484338541,-14.808028519464996,-17.773921003803537,0.9999652777777779,0.9807018483368506,0.9807018483368506,0.17589534515792088,0.7057720843878337,,0.0,0.4,0.2,0.4,COMPLETE
1,0.12384639300803821,2026-09-08 14:02:26.772095,2026-09-08 14:02:27.390692,0 days 00:00:00.618597,uniform,True,0.8099740855262533,4.834453088611124,0.0,0.662294735070819,0.5146153846153847,1.8272081007652847,-14.808028519464996,-16.63523662023028,1.0,0.9821416496618436,0.9821416496618436,0.12384639300803821,0.7053575051014469,,0.0,0.4,0.2,0.4,COMPLETE
2,0.5491053880034392,2026-09-08 14:02:27.391042,2026-09-08 14:02:28.312156,0 days 00:00:00.921114,gamma,False,0.8588469490029387,6.414627985112265,0.0,0.7232215514245464,0.5875961538461539,-3.7295834999857824,-14.808028519464996,-11.078445019479213,1.0,0.9969461238936786,0.9969461238936786,0.5491053880034392,0.7009161628318965,,1.0,0.4,0.2,0.4,COMPLETE
3,0.12384639300803821,2026-09-08 14:02:28.312544,2026-09-08 14:02:28.888061,0 days 00:00:00.575517,uniform,False,0.8099740855262533,4.834453088611124,0.0,0.662294735070819,0.5146153846153847,1.8272081007652847,-14.808028519464996,-16.63523662023028,1.0,0.9821416496618436,0.9821416496618436,0.12384639300803821,0.7053575051014469,,0.0,0.4,0.2,0.4,COMPLETE
4,0.6091088998099426,2026-09-08 14:02:28.888397,2026-09-08 14:02:29.486547,0 days 00:00:00.598150,norm,False,0.9741234975687532,1.962316909224377,0.0,0.8753309795536075,0.7765384615384617,-1.7880195995587211,-14.808028519464996,-13.020008919906275,1.0,0.9829417998083259,0.9829417998083259,0.6091088998099426,0.7051174600575023,,1.0,0.4,0.2,0.4,COMPLETE
5,0.465834601168575,2026-09-08 14:02:29.486796,2026-09-08 14:02:30.690213,0 days 00:00:01.203417,beta,False,0.902377250819683,1.597014365671623,0.0,0.8308040100252261,0.7592307692307692,0.31125148808046,-14.808028519464996,-15.119280007545456,1.0,0.9668932065111405,0.9668932065111405,0.465834601168575,0.7099320380466578,,0.68874851191954,0.4,0.2,0.4,COMPLETE
6,0.17589534515792088,2026-09-08 14:02:30.690716,2026-09-08 14:02:31.350428,0 days 00:00:00.659712,truncnorm,False,0.8923641947928226,1.8616515688647621,0.0,0.792624405088719,0.6928846153846154,2.965892484338541,-14.808028519464996,-17.773921003803537,0.9999652777777779,0.9807018483368506,0.9807018483368506,0.17589534515792088,0.7057720843878337,,0.0,0.4,0.2,0.4,COMPLETE
7,0.17589534515792088,2026-09-08 14:02:31.350762,2026-09-08 14:02:31.996066,0 days 00:00:00.645304,truncnorm,False,0.8923641947928226,1.8616515688647621,0.0,0.792624405088719,0.6928846153846154,2.965892484338541,-14.808028519464996,-17.773921003803537,0.9999652777777779,0.9807018483368506,0.9807018483368506,0.17589534515792088,0.7057720843878337,,0.0,0.4,0.2,0.4,COMPLETE
8,0.12384639300803821,2026-09-08 14:02:31.996319,2026-09-08 14:02:32.570655,0 days 00:00:00.574336,uniform,False,0.8099740855262533,4.834453088611124,0.0,0.662294735070819,0.5146153846153847,1.8272081007652847,-14.808028519464996,-16.63523662023028,1.0,0.9821416496618436,0.9821416496618436,0.12384639300803821,0.7053575051014469,,0.0,0.4,0.2,0.4,COMPLETE
9,0.12384639300803821,2026-09-08 14:02:32.570982,2026-09-08 14:02:33.144110,0 days 00:00:00.573128,uniform,False,0.8099740855262533,4.834453088611124,0.0,0.662294735070819,0.5146153846153847,1.8272081007652847,-14.808028519464996,-16.63523662023028,1.0,0.9821416496618436,0.9821416496618436,0.12384639300803821,0.7053575051014469,,0.0,0.4,0.2,0.4,COMPLETE
10,0.6082828037330656,2026-09-08 14:02:33.144288,2026-09-08 14:02:33.791288,0 days 00:00:00.647000,norm,True,0.9707095393753017,1.7448775925379754,0.0,0.8736240004568817,0.7765384615384617,-1.0544852138062417,-14.808028519464996,-13.753543305658754,0.9989409722222222,0.9787883462089196,0.9787883462089196,0.6082828037330656,0.7058339822484352,,1.0,0.4,0.2,0.4,COMPLETE
11,0.6082828037330656,2026-09-08 14:02:33.791532,2026-09-08 14:02:34.408513,0 days 00:00:00.616981,norm,True,0.9707095393753017,1.7448775925379754,0.0,0.8736240004568817,0.7765384615384617,-1.0544852138062417,-14.808028519464996,-13.753543305658754,0.9989409722222222,0.9787883462089196,0.9787883462089196,0.6082828037330656,0.7058339822484352,,1.0,0.4,0.2,0.4,COMPLETE
12,0.6082828037330656,2026-09-08 14:02:34.408757,2026-09-08 14:02:35.233279,0 days 00:00:00.824522,norm,True,0.9707095393753017,1.7448775925379754,0.0,0.8736240004568817,0.7765384615384617,-1.0544852138062417,-14.808028519464996,-13.753543305658754,0.9989409722222222,0.9787883462089196,0.9787883462089196,0.6082828037330656,0.7058339822484352,,1.0,0.4,0.2,0.4,COMPLETE
13,0.6082828037330656,2026-09-08 14:02:35.233524,2026-09-08 14:02:35.849907,0 days 00:00:00.616383,norm,True,0.9707095393753017,1.7448775925379754,0.0,0.8736240004568817,0.7765384615384617,-1.0544852138062417,-14.808028519464996,-13.753543305658754,0.9989409722222222,0.9787883462089196,0.9787883462089196,0.6082828037330656,0.7058339822484352,,1.0,0.4,0.2,0.4,COMPLETE
14,0.6082828037330656,2026-09-08 14:02:35.850116,2026-09-08 14:02:36.453569,0 days 00:00:00.603453,norm,True,0.9707095393753017,1.7448775925379754,0.0,0.8736240004568817,0.7765384615384617,-1.0544852138062417,-14.808028519464996,-13.753543305658754,0.9989409722222222,0.9787883462089196,0.9787883462089196,0.6082828037330656,0.7058339822484352,,1.0,0.4,0.2,0.4,COMPLETE
15,0.6082828037330656,2026-09-08 14:02:36.453905,2026-09-08 14:02:37.056183,0 days 00:00:00.602278,norm,True,0.9707095393753017,1.7448775925379754,0.0,0.8736240004568817,0.7765384615384617,-1.0544852138062417,-14.808028519464996,-13.753543305658754,0.9989409722222222,0.9787883462089196,0.9787883462089196,0.6082828037330656,0.7058339822484352,,1.0,0.4,0.2,0.4,COMPLETE
16,0.48185450359434956,2026-09-08 14:02:37.056353,2026-09-08 14:02:38.265196,0 days 00:00:01.208843,beta,True,0.9019943498499878,1.5079035395525366,0.0,0.8306606364634554,0.7593269230769231,0.27113854092602985,-14.808028519464996,-15.079167060391026,0.9997916666666667,0.9670805341007664,0.9670805341007664,0.48185450359434956,0.7097716731031034,,0.7288614590739702,0.4,0.2,0.4,COMPLETE
17,0.5491053880034392,2026-09-08 14:02:38.265426,2026-09-08 14:02:39.160012,0 days 00:00:00.894586,gamma,False,0.8588469490029387,6.414627985112265,0.0,0.7232215514245464,0.5875961538461539,-3.7295834999857824,-14.808028519464996,-11.078445019479213,1.0,0.9969461238936786,0.9969461238936786,0.5491053880034392,0.7009161628318965,,1.0,0.4,0.2,0.4,COMPLETE
18,0.6082828037330656,2026-09-08 14:02:39.160321,2026-09-08 14:02:39.761933,0 days 00:00:00.601612,norm,True,0.9707095393753017,1.7448775925379754,0.0,0.8736240004568817,0.7765384615384617,-1.0544852138062417,-14.808028519464996,-13.753543305658754,0.9989409722222222,0.9787883462089196,0.9787883462089196,0.6082828037330656,0.7058339822484352,,1.0,0.4,0.2,0.4,COMPLETE
19,0.6091088998099426,2026-09-08 14:02:39.762092,2026-09-08 14:02:40.356098,0 days 00:00:00.594006,norm,False,0.9741234975687532,1.962316909224377,0.0,0.8753309795536075,0.7765384615384617,-1.7880195995587211,-14.808028519464996,-13.020008919906275,1.0,0.9829417998083259,0.9829417998083259,0.6091088998099426,0.7051174600575023,,1.0,0.4,0.2,0.4,COMPLETE
