number,value,datetime_start,datetime_complete,duration,params_default_distribution,params_enforce_min_max_values,user_attrs_corr_similarity,user_attrs_dcr,user_attrs_dcr_norm,user_attrs_fidelity,user_attrs_ks_similarity,user_attrs_mean_f1_gap,user_attrs_mean_trtr_f1,user_attrs_mean_tstr_f1,user_attrs_mia_auc,user_attrs_nndr,user_attrs_nndr_norm,user_attrs_objective,user_attrs_privacy_risk,user_attrs_sdv_quality,user_attrs_utility,user_attrs_w_fidelity,user_attrs_w_privacy_risk,user_attrs_w_utility,state
0,0.5415629736694163,2026-09-02 17:00:17.476071,2026-09-02 17:00:18.348702,0 days 00:00:00.872631,truncnorm,True,0.9420923484690621,1.8166885493145148,0.0,0.9100045075678644,0.8779166666666667,0.20226339564321438,0.32320184383699385,0.12093844819377943,0.9863888888888888,0.9517569631407529,0.9517569631407529,0.5415629736694163,0.7076673555022186,,0.7977366043567856,0.4,0.2,0.4,COMPLETE
1,0.4814511015690834,2026-09-02 17:00:18.349060,2026-09-02 17:00:19.178953,0 days 00:00:00.829893,uniform,True,0.9290460865610737,7.304490363831733,0.0,0.7635334599472035,0.5980208333333333,0.20387630478738053,0.32320184383699385,0.1193255390496133,0.99921875,0.9585019084192359,0.9585019084192359,0.4814511015690834,0.7120588024742294,,0.7961236952126195,0.4,0.2,0.4,COMPLETE
2,0.5198748895613516,2026-09-02 17:00:19.179171,2026-09-02 17:00:20.201458,0 days 00:00:01.022287,gamma,False,0.9379786326634321,1.9696942169156362,0.0,0.8850309829983827,0.8320833333333333,0.22761846314296685,0.32320184383699385,0.09558338069402694,0.9995138888888888,0.9476878418012372,0.9476878418012372,0.5198748895613516,0.7154505919040732,,0.7723815368570331,0.4,0.2,0.4,COMPLETE
3,0.4814511015690834,2026-09-02 17:00:20.201729,2026-09-02 17:00:21.015508,0 days 00:00:00.813779,uniform,False,0.9290460865610737,7.304490363831733,0.0,0.7635334599472035,0.5980208333333333,0.20387630478738053,0.32320184383699385,0.1193255390496133,0.99921875,0.9585019084192359,0.9585019084192359,0.4814511015690834,0.7120588024742294,,0.7961236952126195,0.4,0.2,0.4,COMPLETE
4,0.5741129778709819,2026-09-02 17:00:21.015871,2026-09-02 17:00:21.838138,0 days 00:00:00.822267,norm,False,0.9528364016096971,1.77070394242647,0.0,0.9266265341381819,0.9004166666666668,0.16636762341972036,0.32320184383699385,0.15683422041727343,0.8656597222222222,0.9429230967636593,0.9429230967636593,0.5741129778709819,0.6499529320820133,,0.8336323765802797,0.4,0.2,0.4,COMPLETE
5,0.5663037893326257,2026-09-02 17:00:21.838349,2026-09-02 17:00:23.195522,0 days 00:00:01.357173,beta,False,0.9381995902362471,1.6667867414679685,0.0,0.9360789617847902,0.9339583333333334,0.20284000270933591,0.32320184383699385,0.12036184112765787,0.8315798611111112,0.9361031968925854,0.9361031968925854,0.5663037893326257,0.6349589714877799,,0.7971599972906641,0.4,0.2,0.4,COMPLETE
6,0.5415629736694163,2026-09-02 17:00:23.195913,2026-09-02 17:00:24.070791,0 days 00:00:00.874878,truncnorm,False,0.9420923484690621,1.8166885493145148,0.0,0.9100045075678644,0.8779166666666667,0.20226339564321438,0.32320184383699385,0.12093844819377943,0.9863888888888888,0.9517569631407529,0.9517569631407529,0.5415629736694163,0.7076673555022186,,0.7977366043567856,0.4,0.2,0.4,COMPLETE
7,0.5415629736694163,2026-09-02 17:00:24.071052,2026-09-02 17:00:24.935937,0 days 00:00:00.864885,truncnorm,False,0.9420923484690621,1.8166885493145148,0.0,0.9100045075678644,0.8779166666666667,0.20226339564321438,0.32320184383699385,0.12093844819377943,0.9863888888888888,0.9517569631407529,0.9517569631407529,0.5415629736694163,0.7076673555022186,,0.7977366043567856,0.4,0.2,0.4,COMPLETE
8,0.4814511015690834,2026-09-02 17:00:24.936284,2026-09-02 17:00:25.725212,0 days 00:00:00.788928,uniform,False,0.9290460865610737,7.304490363831733,0.0,0.7635334599472035,0.5980208333333333,0.20387630478738053,0.32320184383699385,0.1193255390496133,0.99921875,0.9585019084192359,0.9585019084192359,0.4814511015690834,0.7120588024742294,,0.7961236952126195,0.4,0.2,0.4,COMPLETE
9,0.4814511015690834,2026-09-02 17:00:25.725414,2026-09-02 17:00:26.507538,0 days 00:00:00.782124,uniform,False,0.9290460865610737,7.304490363831733,0.0,0.7635334599472035,0.5980208333333333,0.20387630478738053,0.32320184383699385,0.1193255390496133,0.99921875,0.9585019084192359,0.9585019084192359,0.4814511015690834,0.7120588024742294,,0.7961236952126195,0.4,0.2,0.4,COMPLETE
10,0.5700666814233769,2026-09-02 17:00:26.507809,2026-09-02 17:00:27.327916,0 days 00:00:00.820107,norm,True,0.9522483514030032,1.7122174828372148,0.0,0.926332509034835,0.9004166666666668,0.17573543684833506,0.32320184383699385,0.14746640698865873,0.8646180555555555,0.9381609684055416,0.9381609684055416,0.5700666814233769,0.6508607372561153,,0.824264563151665,0.4,0.2,0.4,COMPLETE
11,0.5700666814233769,2026-09-02 17:00:27.328262,2026-09-02 17:00:28.166233,0 days 00:00:00.837971,norm,True,0.9522483514030032,1.7122174828372148,0.0,0.926332509034835,0.9004166666666668,0.17573543684833506,0.32320184383699385,0.14746640698865873,0.8646180555555555,0.9381609684055416,0.9381609684055416,0.5700666814233769,0.6508607372561153,,0.824264563151665,0.4,0.2,0.4,COMPLETE
12,0.5700666814233769,2026-09-02 17:00:28.166440,2026-09-02 17:00:29.210420,0 days 00:00:01.043980,norm,True,0.9522483514030032,1.7122174828372148,0.0,0.926332509034835,0.9004166666666668,0.17573543684833506,0.32320184383699385,0.14746640698865873,0.8646180555555555,0.9381609684055416,0.9381609684055416,0.5700666814233769,0.6508607372561153,,0.824264563151665,0.4,0.2,0.4,COMPLETE
13,0.5700666814233769,2026-09-02 17:00:29.210632,2026-09-02 17:00:30.023322,0 days 00:00:00.812690,norm,True,0.9522483514030032,1.7122174828372148,0.0,0.926332509034835,0.9004166666666668,0.17573543684833506,0.32320184383699385,0.14746640698865873,0.8646180555555555,0.9381609684055416,0.9381609684055416,0.5700666814233769,0.6508607372561153,,0.824264563151665,0.4,0.2,0.4,COMPLETE
14,0.5700666814233769,2026-09-02 17:00:30.023510,2026-09-02 17:00:30.842851,0 days 00:00:00.819341,norm,True,0.9522483514030032,1.7122174828372148,0.0,0.926332509034835,0.9004166666666668,0.17573543684833506,0.32320184383699385,0.14746640698865873,0.8646180555555555,0.9381609684055416,0.9381609684055416,0.5700666814233769,0.6508607372561153,,0.824264563151665,0.4,0.2,0.4,COMPLETE
15,0.5700666814233769,2026-09-02 17:00:30.843141,2026-09-02 17:00:31.673731,0 days 00:00:00.830590,norm,True,0.9522483514030032,1.7122174828372148,0.0,0.926332509034835,0.9004166666666668,0.17573543684833506,0.32320184383699385,0.14746640698865873,0.8646180555555555,0.9381609684055416,0.9381609684055416,0.5700666814233769,0.6508607372561153,,0.824264563151665,0.4,0.2,0.4,COMPLETE
16,0.5662645760588481,2026-09-02 17:00:31.673932,2026-09-02 17:00:33.057540,0 days 00:00:01.383608,beta,True,0.9381914728284851,1.6639228461462863,0.0,0.9360749030809092,0.9339583333333334,0.20297360519754362,0.32320184383699385,0.12022823863945016,0.8313020833333333,0.9359044206472514,0.9359044206472514,0.5662645760588481,0.6348797154724912,,0.7970263948024564,0.4,0.2,0.4,COMPLETE
17,0.5198748895613516,2026-09-02 17:00:33.057888,2026-09-02 17:00:34.101589,0 days 00:00:01.043701,gamma,False,0.9379786326634321,1.9696942169156362,0.0,0.8850309829983827,0.8320833333333333,0.22761846314296685,0.32320184383699385,0.09558338069402694,0.9995138888888888,0.9476878418012372,0.9476878418012372,0.5198748895613516,0.7154505919040732,,0.7723815368570331,0.4,0.2,0.4,COMPLETE
18,0.5700666814233769,2026-09-02 17:00:34.101803,2026-09-02 17:00:34.931384,0 days 00:00:00.829581,norm,True,0.9522483514030032,1.7122174828372148,0.0,0.926332509034835,0.9004166666666668,0.17573543684833506,0.32320184383699385,0.14746640698865873,0.8646180555555555,0.9381609684055416,0.9381609684055416,0.5700666814233769,0.6508607372561153,,0.824264563151665,0.4,0.2,0.4,COMPLETE
19,0.5741129778709819,2026-09-02 17:00:34.931659,2026-09-02 17:00:35.730282,0 days 00:00:00.798623,norm,False,0.9528364016096971,1.77070394242647,0.0,0.9266265341381819,0.9004166666666668,0.16636762341972036,0.32320184383699385,0.15683422041727343,0.8656597222222222,0.9429230967636593,0.9429230967636593,0.5741129778709819,0.6499529320820133,,0.8336323765802797,0.4,0.2,0.4,COMPLETE
