number,value,datetime_start,datetime_complete,duration,params_default_distribution,params_enforce_min_max_values,user_attrs_corr_similarity,user_attrs_dcr,user_attrs_dcr_norm,user_attrs_fidelity,user_attrs_ks_similarity,user_attrs_mean_f1_gap,user_attrs_mean_trtr_f1,user_attrs_mean_tstr_f1,user_attrs_mia_auc,user_attrs_nndr,user_attrs_nndr_norm,user_attrs_objective,user_attrs_privacy_risk,user_attrs_sdv_quality,user_attrs_utility,user_attrs_w_fidelity,user_attrs_w_privacy_risk,user_attrs_w_utility,state
0,0.5861963031264957,2026-09-09 13:05:22.575664,2026-09-09 13:05:23.048364,0 days 00:00:00.472700,truncnorm,True,0.919877199616856,1.256315391077593,0.0,0.8608343652807406,0.8017915309446254,0.03464945147850207,-1.8295449815845748,-1.8641944330630769,1.0,0.928705626760004,0.928705626760004,0.5861963031264957,0.7213883119719988,,0.9653505485214979,0.4,0.2,0.4,COMPLETE
1,0.594096879635005,2026-09-09 13:05:23.048660,2026-09-09 13:05:23.457436,0 days 00:00:00.408776,uniform,True,0.9123183596611429,1.4560848092004308,0.0,0.8441070625667279,0.7758957654723128,-0.05907063776848265,-1.8295449815845748,-1.7704743438160921,1.0,0.9409009101385638,0.9409009101385638,0.594096879635005,0.7177297269584308,,1.0,0.4,0.2,0.4,COMPLETE
2,0.6007189166115642,2026-09-09 13:05:23.457641,2026-09-09 13:05:24.087730,0 days 00:00:00.630089,gamma,False,0.918226574974,1.612606744909229,0.0,0.8587875545879772,0.7993485342019544,-0.07545112813568622,-1.8295449815845748,-1.7540938534488886,1.0,0.9533982462728872,0.9533982462728872,0.6007189166115642,0.7139805261181338,,1.0,0.4,0.2,0.4,COMPLETE
3,0.594096879635005,2026-09-09 13:05:24.088069,2026-09-09 13:05:24.492040,0 days 00:00:00.403971,uniform,False,0.9123183596611429,1.4560848092004308,0.0,0.8441070625667279,0.7758957654723128,-0.05907063776848265,-1.8295449815845748,-1.7704743438160921,1.0,0.9409009101385638,0.9409009101385638,0.594096879635005,0.7177297269584308,,1.0,0.4,0.2,0.4,COMPLETE
4,0.616940780427084,2026-09-09 13:05:24.492247,2026-09-09 13:05:24.895322,0 days 00:00:00.403075,norm,False,0.9717525752556432,1.2510113443281181,0.0,0.902895831601763,0.8340390879478827,-0.11645897880946965,-1.8295449815845748,-1.7130860027751051,1.0,0.9297074631063129,0.9297074631063129,0.616940780427084,0.7210877610681061,,1.0,0.4,0.2,0.4,COMPLETE
5,0.5863022325302475,2026-09-09 13:05:24.895660,2026-09-09 13:05:25.674599,0 days 00:00:00.778939,beta,False,0.8752874956498599,1.6517309629611125,0.0,0.8232300670431709,0.7711726384364821,-0.2814144081622345,-1.8295449815845748,-1.5481305734223403,1.0,0.9501700952163179,0.9501700952163179,0.5863022325302475,0.7149489714351047,,1.0,0.4,0.2,0.4,COMPLETE
6,0.5861963031264957,2026-09-09 13:05:25.674831,2026-09-09 13:05:26.128388,0 days 00:00:00.453557,truncnorm,False,0.919877199616856,1.256315391077593,0.0,0.8608343652807406,0.8017915309446254,0.03464945147850207,-1.8295449815845748,-1.8641944330630769,1.0,0.928705626760004,0.928705626760004,0.5861963031264957,0.7213883119719988,,0.9653505485214979,0.4,0.2,0.4,COMPLETE
7,0.5861963031264957,2026-09-09 13:05:26.128727,2026-09-09 13:05:26.581289,0 days 00:00:00.452562,truncnorm,False,0.919877199616856,1.256315391077593,0.0,0.8608343652807406,0.8017915309446254,0.03464945147850207,-1.8295449815845748,-1.8641944330630769,1.0,0.928705626760004,0.928705626760004,0.5861963031264957,0.7213883119719988,,0.9653505485214979,0.4,0.2,0.4,COMPLETE
8,0.594096879635005,2026-09-09 13:05:26.581464,2026-09-09 13:05:27.004037,0 days 00:00:00.422573,uniform,False,0.9123183596611429,1.4560848092004308,0.0,0.8441070625667279,0.7758957654723128,-0.05907063776848265,-1.8295449815845748,-1.7704743438160921,1.0,0.9409009101385638,0.9409009101385638,0.594096879635005,0.7177297269584308,,1.0,0.4,0.2,0.4,COMPLETE
9,0.594096879635005,2026-09-09 13:05:27.004251,2026-09-09 13:05:27.404425,0 days 00:00:00.400174,uniform,False,0.9123183596611429,1.4560848092004308,0.0,0.8441070625667279,0.7758957654723128,-0.05907063776848265,-1.8295449815845748,-1.7704743438160921,1.0,0.9409009101385638,0.9409009101385638,0.594096879635005,0.7177297269584308,,1.0,0.4,0.2,0.4,COMPLETE
10,0.5690201821230649,2026-09-09 13:05:27.404658,2026-09-09 13:05:27.809619,0 days 00:00:00.404961,norm,True,0.9727371613162957,1.106395798966087,0.0,0.9033881246320892,0.8340390879478827,0.11757597286140253,-1.8295449815845748,-1.9471209544459773,0.9997943595769683,0.911245956208119,0.911245956208119,0.5690201821230649,0.7265233929260484,,0.8824240271385975,0.4,0.2,0.4,COMPLETE
11,0.6007189166115642,2026-09-09 13:05:27.809801,2026-09-09 13:05:28.434726,0 days 00:00:00.624925,gamma,False,0.918226574974,1.612606744909229,0.0,0.8587875545879772,0.7993485342019544,-0.07545112813568622,-1.8295449815845748,-1.7540938534488886,1.0,0.9533982462728872,0.9533982462728872,0.6007189166115642,0.7139805261181338,,1.0,0.4,0.2,0.4,COMPLETE
12,0.616940780427084,2026-09-09 13:05:28.435062,2026-09-09 13:05:28.835175,0 days 00:00:00.400113,norm,False,0.9717525752556432,1.2510113443281181,0.0,0.902895831601763,0.8340390879478827,-0.11645897880946965,-1.8295449815845748,-1.7130860027751051,1.0,0.9297074631063129,0.9297074631063129,0.616940780427084,0.7210877610681061,,1.0,0.4,0.2,0.4,COMPLETE
13,0.616940780427084,2026-09-09 13:05:28.835355,2026-09-09 13:05:29.236034,0 days 00:00:00.400679,norm,False,0.9717525752556432,1.2510113443281181,0.0,0.902895831601763,0.8340390879478827,-0.11645897880946965,-1.8295449815845748,-1.7130860027751051,1.0,0.9297074631063129,0.9297074631063129,0.616940780427084,0.7210877610681061,,1.0,0.4,0.2,0.4,COMPLETE
14,0.5690201821230649,2026-09-09 13:05:29.236213,2026-09-09 13:05:29.871989,0 days 00:00:00.635776,norm,True,0.9727371613162957,1.106395798966087,0.0,0.9033881246320892,0.8340390879478827,0.11757597286140253,-1.8295449815845748,-1.9471209544459773,0.9997943595769683,0.911245956208119,0.911245956208119,0.5690201821230649,0.7265233929260484,,0.8824240271385975,0.4,0.2,0.4,COMPLETE
15,0.616940780427084,2026-09-09 13:05:29.872191,2026-09-09 13:05:30.271799,0 days 00:00:00.399608,norm,False,0.9717525752556432,1.2510113443281181,0.0,0.902895831601763,0.8340390879478827,-0.11645897880946965,-1.8295449815845748,-1.7130860027751051,1.0,0.9297074631063129,0.9297074631063129,0.616940780427084,0.7210877610681061,,1.0,0.4,0.2,0.4,COMPLETE
16,0.616940780427084,2026-09-09 13:05:30.271995,2026-09-09 13:05:30.674434,0 days 00:00:00.402439,norm,False,0.9717525752556432,1.2510113443281181,0.0,0.902895831601763,0.8340390879478827,-0.11645897880946965,-1.8295449815845748,-1.7130860027751051,1.0,0.9297074631063129,0.9297074631063129,0.616940780427084,0.7210877610681061,,1.0,0.4,0.2,0.4,COMPLETE
17,0.5863022325302475,2026-09-09 13:05:30.674750,2026-09-09 13:05:31.450526,0 days 00:00:00.775776,beta,False,0.8752874956498599,1.6517309629611125,0.0,0.8232300670431709,0.7711726384364821,-0.2814144081622345,-1.8295449815845748,-1.5481305734223403,1.0,0.9501700952163179,0.9501700952163179,0.5863022325302475,0.7149489714351047,,1.0,0.4,0.2,0.4,COMPLETE
18,0.5690201821230649,2026-09-09 13:05:31.450702,2026-09-09 13:05:31.863727,0 days 00:00:00.413025,norm,True,0.9727371613162957,1.106395798966087,0.0,0.9033881246320892,0.8340390879478827,0.11757597286140253,-1.8295449815845748,-1.9471209544459773,0.9997943595769683,0.911245956208119,0.911245956208119,0.5690201821230649,0.7265233929260484,,0.8824240271385975,0.4,0.2,0.4,COMPLETE
19,0.616940780427084,2026-09-09 13:05:31.863941,2026-09-09 13:05:32.269163,0 days 00:00:00.405222,norm,False,0.9717525752556432,1.2510113443281181,0.0,0.902895831601763,0.8340390879478827,-0.11645897880946965,-1.8295449815845748,-1.7130860027751051,1.0,0.9297074631063129,0.9297074631063129,0.616940780427084,0.7210877610681061,,1.0,0.4,0.2,0.4,COMPLETE
